"No.","Time","Source","Destination","Protocol","Length","Info"
"1","0.000000","131.202.240.242","10.0.2.15","UDP","60","62177  >  15685 Len=3"
"2","0.002267","10.0.2.15","131.202.240.242","UDP","45","15685  >  62177 Len=3"
"3","3.611318","10.0.2.15","157.56.52.13","TCP","452","34332  >  40011 [PSH, ACK] Seq=1 Ack=1 Win=31088 Len=398"
"4","3.611776","157.56.52.13","10.0.2.15","TCP","60","40011  >  34332 [ACK] Seq=1 Ack=399 Win=65535 Len=0"
"5","3.696500","157.56.52.13","10.0.2.15","TCP","60","40011  >  34332 [PSH, ACK] Seq=1 Ack=399 Win=65535 Len=4"
"6","3.735337","10.0.2.15","157.56.52.13","TCP","54","34332  >  40011 [ACK] Seq=399 Ack=5 Win=31088 Len=0"
"7","5.614958","24.140.134.21","10.0.2.15","TCP","68","45411  >  56917 [PSH, ACK] Seq=1 Ack=1 Win=65535 Len=14"
"8","5.615050","10.0.2.15","24.140.134.21","TCP","54","56917  >  45411 [ACK] Seq=1 Ack=15 Win=31772 Len=0"
"9","5.615647","10.0.2.15","24.140.134.21","TCP","58","56917  >  45411 [PSH, ACK] Seq=1 Ack=15 Win=31772 Len=4"
"10","5.615910","24.140.134.21","10.0.2.15","TCP","60","45411  >  56917 [ACK] Seq=15 Ack=5 Win=65535 Len=0"
"11","6.170407","10.0.2.15","157.56.52.13","TCP","93","34332  >  40011 [PSH, ACK] Seq=399 Ack=5 Win=31088 Len=39"
"12","6.171324","157.56.52.13","10.0.2.15","TCP","60","40011  >  34332 [ACK] Seq=5 Ack=438 Win=65535 Len=0"
"13","6.256803","157.56.52.13","10.0.2.15","TCP","60","40011  >  34332 [PSH, ACK] Seq=5 Ack=438 Win=65535 Len=4"
"14","6.256833","10.0.2.15","157.56.52.13","TCP","54","34332  >  40011 [ACK] Seq=438 Ack=9 Win=31088 Len=0"
"15","9.964087","10.0.2.15","131.202.240.242","UDP","77","15685  >  62177 Len=35"
"16","9.965572","131.202.240.242","10.0.2.15","UDP","76","62177  >  15685 Len=34"
"17","10.016679","10.0.2.15","131.202.240.242","UDP","45","15685  >  62177 Len=3"
"18","10.017406","131.202.240.242","10.0.2.15","UDP","60","62177  >  15685 Len=3"
"19","10.870554","131.202.240.242","10.0.2.15","UDP","65","62177  >  15685 Len=23"
"20","10.975238","10.0.2.15","24.140.134.21","TCP","54","56917  >  45411 [FIN, ACK] Seq=5 Ack=15 Win=31772 Len=0"
"21","10.975528","24.140.134.21","10.0.2.15","TCP","60","45411  >  56917 [ACK] Seq=15 Ack=6 Win=65535 Len=0"
"22","11.041357","24.140.134.21","10.0.2.15","TCP","60","45411  >  56917 [FIN, ACK] Seq=15 Ack=6 Win=65535 Len=0"
"23","11.041395","10.0.2.15","24.140.134.21","TCP","54","56917  >  45411 [ACK] Seq=6 Ack=16 Win=31772 Len=0"
"24","20.026492","10.0.2.15","131.202.240.242","UDP","45","15685  >  62177 Len=3"
"25","20.029099","131.202.240.242","10.0.2.15","UDP","60","62177  >  15685 Len=3"
"26","30.035320","10.0.2.15","131.202.240.242","UDP","45","15685  >  62177 Len=3"
"27","30.035518","10.0.2.15","131.202.240.242","UDP","82","15685  >  62177 Len=40"
"28","30.039382","131.202.240.242","10.0.2.15","UDP","60","62177  >  15685 Len=3"
"29","30.039562","131.202.240.242","10.0.2.15","UDP","83","62177  >  15685 Len=41"
"30","40.062388","131.202.240.242","10.0.2.15","UDP","60","62177  >  15685 Len=3"
"31","50.079799","131.202.240.242","10.0.2.15","UDP","60","62177  >  15685 Len=3"
"32","60.085977","131.202.240.242","10.0.2.15","UDP","60","62177  >  15685 Len=3"
"33","62.643238","10.0.2.15","157.56.52.13","TCP","56","34332  >  40011 [PSH, ACK] Seq=438 Ack=9 Win=31088 Len=2"
"34","62.643663","157.56.52.13","10.0.2.15","TCP","60","40011  >  34332 [ACK] Seq=9 Ack=440 Win=65535 Len=0"
"35","62.645399","10.0.2.15","157.56.52.13","TCP","452","34332  >  40011 [PSH, ACK] Seq=440 Ack=9 Win=31088 Len=398"
"36","62.646578","157.56.52.13","10.0.2.15","TCP","60","40011  >  34332 [ACK] Seq=9 Ack=838 Win=65535 Len=0"
"37","62.851245","157.56.52.13","10.0.2.15","TCP","60","40011  >  34332 [PSH, ACK] Seq=9 Ack=838 Win=65535 Len=4"
"38","62.851399","10.0.2.15","157.56.52.13","TCP","54","34332  >  40011 [ACK] Seq=838 Ack=13 Win=31088 Len=0"
"39","69.782082","10.0.2.15","198.7.63.141","DNS","79","Standard query 0xbfa0 A smtp.googlemail.com"
"40","69.782343","10.0.2.15","78.46.223.24","DNS","79","Standard query 0xbfa0 A smtp.googlemail.com"
"41","69.782442","10.0.2.15","198.7.63.141","DNS","79","Standard query 0xe744 AAAA smtp.googlemail.com"
"42","69.841264","198.7.63.141","10.0.2.15","DNS","270","Standard query response 0xbfa0 A smtp.googlemail.com CNAME googlemail-smtp.l.google.com A 74.125.207.16 NS ns1.google.com NS ns3.google.com NS ns2.google.com NS ns4.google.com A 216.239.32.10 A 216.239.34.10 A 216.239.36.10 A 216.239.38.10"
"43","69.869812","198.7.63.141","10.0.2.15","DNS","282","Standard query response 0xe744 AAAA smtp.googlemail.com CNAME googlemail-smtp.l.google.com AAAA 2607:f8b0:4001:c07::10 NS ns3.google.com NS ns2.google.com NS ns1.google.com NS ns4.google.com A 216.239.32.10 A 216.239.34.10 A 216.239.36.10 A 216.239.38.10"
"44","69.872591","10.0.2.15","74.125.207.16","TCP","74","42846  >  465 [SYN] Seq=0 Win=29200 Len=0 MSS=1460 SACK_PERM TSval=4888072 TSecr=0 WS=128"
"45","69.925935","78.46.223.24","10.0.2.15","DNS","270","Standard query response 0xbfa0 A smtp.googlemail.com CNAME googlemail-smtp.l.google.com A 74.125.206.16 NS ns3.google.com NS ns2.google.com NS ns4.google.com NS ns1.google.com A 216.239.32.10 A 216.239.34.10 A 216.239.36.10 A 216.239.38.10"
"46","69.926026","10.0.2.15","78.46.223.24","ICMP","298","Destination unreachable (Port unreachable)"
"47","69.932268","74.125.207.16","10.0.2.15","TCP","60","465  >  42846 [SYN, ACK] Seq=0 Ack=1 Win=65535 Len=0 MSS=1460"
"48","69.932379","10.0.2.15","74.125.207.16","TCP","54","42846  >  465 [ACK] Seq=1 Ack=1 Win=29200 Len=0"
"49","69.932893","10.0.2.15","74.125.207.16","TLSv1.2","236","Client Hello (SNI=smtp.googlemail.com)"
"50","69.935601","74.125.207.16","10.0.2.15","TCP","60","465  >  42846 [ACK] Seq=1 Ack=183 Win=65535 Len=0"
"51","70.086138","74.125.207.16","10.0.2.15","TLSv1.2","2894","Server Hello"
"52","70.086280","10.0.2.15","74.125.207.16","TCP","54","42846  >  465 [ACK] Seq=183 Ack=2841 Win=34080 Len=0"
"53","70.088812","74.125.207.16","10.0.2.15","TLSv1.2","717","Certificate, Server Key Exchange, Server Hello Done"
"54","70.088882","10.0.2.15","74.125.207.16","TCP","54","42846  >  465 [ACK] Seq=183 Ack=3504 Win=36920 Len=0"
"55","70.092562","131.202.240.242","10.0.2.15","UDP","60","62177  >  15685 Len=3"
"56","70.092978","10.0.2.15","74.125.207.16","TLSv1.2","180","Client Key Exchange, Change Cipher Spec, Encrypted Handshake Message"
"57","70.093207","74.125.207.16","10.0.2.15","TCP","60","465  >  42846 [ACK] Seq=3504 Ack=309 Win=65535 Len=0"
"58","70.117721","10.0.2.15","198.7.63.141","DNS","79","Standard query 0x4921 A clients1.google.com"
"59","70.119018","10.0.2.15","216.58.208.46","TCP","74","53913  >  80 [SYN] Seq=0 Win=29200 Len=0 MSS=1460 SACK_PERM TSval=4888134 TSecr=0 WS=128"
"60","70.119716","10.0.2.15","198.7.63.141","DNS","79","Standard query 0x394c AAAA clients1.google.com"
"61","70.129823","10.0.2.15","198.7.63.141","DNS","79","Standard query 0xe81d A clients1.google.com"
"62","70.143720","74.125.207.16","10.0.2.15","TLSv1.2","300","New Session Ticket, Change Cipher Spec, Encrypted Handshake Message"
"63","70.178402","198.7.63.141","10.0.2.15","DNS","255","Standard query response 0x4921 A clients1.google.com CNAME clients.l.google.com A 216.58.216.238 NS ns2.google.com NS ns4.google.com NS ns3.google.com NS ns1.google.com A 216.239.32.10 A 216.239.34.10 A 216.239.36.10 A 216.239.38.10"
"64","70.178807","198.7.63.141","10.0.2.15","DNS","267","Standard query response 0x394c AAAA clients1.google.com CNAME clients.l.google.com AAAA 2607:f8b0:4009:809::200e NS ns1.google.com NS ns3.google.com NS ns4.google.com NS ns2.google.com A 216.239.32.10 A 216.239.34.10 A 216.239.36.10 A 216.239.38.10"
"65","70.181685","10.0.2.15","74.125.207.16","TCP","54","42846  >  465 [ACK] Seq=309 Ack=3750 Win=39760 Len=0"
"66","70.188948","198.7.63.141","10.0.2.15","DNS","255","Standard query response 0xe81d A clients1.google.com CNAME clients.l.google.com A 216.58.216.238 NS ns3.google.com NS ns1.google.com NS ns2.google.com NS ns4.google.com A 216.239.32.10 A 216.239.34.10 A 216.239.36.10 A 216.239.38.10"
"67","70.235224","216.58.208.46","10.0.2.15","TCP","60","80  >  53913 [SYN, ACK] Seq=0 Ack=1 Win=65535 Len=0 MSS=1460"
"68","70.235328","10.0.2.15","216.58.208.46","TCP","54","53913  >  80 [ACK] Seq=1 Ack=1 Win=29200 Len=0"
"69","70.235685","10.0.2.15","216.58.208.46","OCSP","489","Request"
"70","70.235846","216.58.208.46","10.0.2.15","TCP","60","80  >  53913 [ACK] Seq=1 Ack=436 Win=65535 Len=0"
"71","70.268528","74.125.207.16","10.0.2.15","TLSv1.2","135","Application Data"
"72","70.268576","10.0.2.15","74.125.207.16","TCP","54","42846  >  465 [ACK] Seq=309 Ack=3831 Win=39760 Len=0"
"73","70.705045","216.58.208.46","10.0.2.15","OCSP","833","Response"
"74","70.705121","10.0.2.15","216.58.208.46","TCP","54","53913  >  80 [ACK] Seq=436 Ack=780 Win=30381 Len=0"
"75","70.767914","10.0.2.15","74.125.207.16","TLSv1.2","101","Application Data"
"76","70.768622","74.125.207.16","10.0.2.15","TCP","60","465  >  42846 [ACK] Seq=3831 Ack=356 Win=65535 Len=0"
"77","70.820727","74.125.207.16","10.0.2.15","TLSv1.2","293","Application Data"
"78","70.820752","10.0.2.15","74.125.207.16","TCP","54","42846  >  465 [ACK] Seq=356 Ack=4070 Win=42600 Len=0"
"79","70.832349","10.0.2.15","74.125.207.16","TLSv1.2","136","Application Data"
"80","70.832981","74.125.207.16","10.0.2.15","TCP","60","465  >  42846 [ACK] Seq=4070 Ack=438 Win=65535 Len=0"
"81","71.377288","74.125.207.16","10.0.2.15","TLSv1.2","103","Application Data"
"82","71.377724","10.0.2.15","74.125.207.16","TLSv1.2","125","Application Data"
"83","71.377962","74.125.207.16","10.0.2.15","TCP","60","465  >  42846 [ACK] Seq=4119 Ack=509 Win=65535 Len=0"
"84","71.429652","74.125.207.16","10.0.2.15","TLSv1.2","124","Application Data"
"85","71.432116","10.0.2.15","74.125.207.16","TLSv1.2","114","Application Data"
"86","71.432393","74.125.207.16","10.0.2.15","TCP","60","465  >  42846 [ACK] Seq=4189 Ack=569 Win=65535 Len=0"
"87","71.489506","74.125.207.16","10.0.2.15","TLSv1.2","124","Application Data"
"88","71.503547","10.0.2.15","74.125.207.16","TLSv1.2","89","Application Data"
"89","71.503941","74.125.207.16","10.0.2.15","TCP","60","465  >  42846 [ACK] Seq=4259 Ack=604 Win=65535 Len=0"
"90","72.077644","74.125.207.16","10.0.2.15","TLSv1.2","125","Application Data"
"91","72.118429","10.0.2.15","74.125.207.16","TCP","54","42846  >  465 [ACK] Seq=604 Ack=4330 Win=42600 Len=0"
"92","72.149335","10.0.2.15","74.125.207.16","TLSv1.2","445","Application Data"
"93","72.149680","74.125.207.16","10.0.2.15","TCP","60","465  >  42846 [ACK] Seq=4330 Ack=995 Win=65535 Len=0"
"94","73.173717","74.125.207.16","10.0.2.15","TLSv1.2","135","Application Data"
"95","73.173767","10.0.2.15","74.125.207.16","TCP","54","42846  >  465 [ACK] Seq=995 Ack=4411 Win=42600 Len=0"
"96","73.207492","10.0.2.15","74.125.207.16","TLSv1.2","89","Application Data"
"97","73.207849","74.125.207.16","10.0.2.15","TCP","60","465  >  42846 [ACK] Seq=4411 Ack=1030 Win=65535 Len=0"
"98","73.257698","74.125.207.16","10.0.2.15","TLSv1.2","140","Application Data"
"99","73.257735","74.125.207.16","10.0.2.15","TCP","60","465  >  42846 [FIN, ACK] Seq=4497 Ack=1030 Win=65535 Len=0"
"100","73.297663","10.0.2.15","74.125.207.16","TCP","54","42846  >  465 [ACK] Seq=1030 Ack=4498 Win=42600 Len=0"
"101","73.366798","10.0.2.15","74.125.207.16","TLSv1.2","85","Encrypted Alert"
"102","73.366844","10.0.2.15","74.125.207.16","TCP","54","42846  >  465 [FIN, ACK] Seq=1061 Ack=4498 Win=42600 Len=0"
"103","73.367643","74.125.207.16","10.0.2.15","TCP","60","465  >  42846 [ACK] Seq=4498 Ack=1061 Win=65535 Len=0"
"104","73.367663","74.125.207.16","10.0.2.15","TCP","60","465  >  42846 [ACK] Seq=4498 Ack=1062 Win=65535 Len=0"
"105","80.098468","131.202.240.242","10.0.2.15","UDP","60","62177  >  15685 Len=3"
"106","80.702377","10.0.2.15","216.58.208.46","TCP","54","[TCP Keep-Alive] 53913  >  80 [ACK] Seq=435 Ack=780 Win=30381 Len=0"
"107","80.702812","216.58.208.46","10.0.2.15","TCP","60","[TCP Keep-Alive ACK] 80  >  53913 [ACK] Seq=780 Ack=436 Win=65535 Len=0"
"108","90.734499","10.0.2.15","216.58.208.46","TCP","54","[TCP Keep-Alive] 53913  >  80 [ACK] Seq=435 Ack=780 Win=30381 Len=0"
"109","90.734758","216.58.208.46","10.0.2.15","TCP","60","[TCP Keep-Alive ACK] 80  >  53913 [ACK] Seq=780 Ack=436 Win=65535 Len=0"
"110","98.425304","10.0.2.15","74.125.207.16","TCP","74","42848  >  465 [SYN] Seq=0 Win=29200 Len=0 MSS=1460 SACK_PERM TSval=4895210 TSecr=0 WS=128"
"111","98.475874","74.125.207.16","10.0.2.15","TCP","60","465  >  42848 [SYN, ACK] Seq=0 Ack=1 Win=65535 Len=0 MSS=1460"
"112","98.476029","10.0.2.15","74.125.207.16","TCP","54","42848  >  465 [ACK] Seq=1 Ack=1 Win=29200 Len=0"
"113","98.476531","10.0.2.15","74.125.207.16","TLSv1.2","571","Client Hello (SNI=smtp.googlemail.com)"
"114","98.477266","74.125.207.16","10.0.2.15","TCP","60","465  >  42848 [ACK] Seq=1 Ack=518 Win=65535 Len=0"
"115","98.525315","74.125.207.16","10.0.2.15","TLSv1.2","191","Server Hello, Change Cipher Spec, Encrypted Handshake Message"
"116","98.525390","10.0.2.15","74.125.207.16","TCP","54","42848  >  465 [ACK] Seq=518 Ack=138 Win=30016 Len=0"
"117","98.530419","10.0.2.15","74.125.207.16","TLSv1.2","105","Change Cipher Spec, Encrypted Handshake Message"
"118","98.530790","74.125.207.16","10.0.2.15","TCP","60","465  >  42848 [ACK] Seq=138 Ack=569 Win=65535 Len=0"
"119","98.643826","74.125.207.16","10.0.2.15","TLSv1.2","134","Application Data"
"120","98.681707","10.0.2.15","74.125.207.16","TCP","54","42848  >  465 [ACK] Seq=569 Ack=218 Win=30016 Len=0"
"121","98.714149","10.0.2.15","74.125.207.16","TLSv1.2","101","Application Data"
"122","98.714540","74.125.207.16","10.0.2.15","TCP","60","465  >  42848 [ACK] Seq=218 Ack=616 Win=65535 Len=0"
"123","98.774264","74.125.207.16","10.0.2.15","TLSv1.2","293","Application Data"
"124","98.774368","10.0.2.15","74.125.207.16","TCP","54","42848  >  465 [ACK] Seq=616 Ack=457 Win=31088 Len=0"
"125","98.783694","10.0.2.15","74.125.207.16","TLSv1.2","136","Application Data"
"126","98.783926","74.125.207.16","10.0.2.15","TCP","60","465  >  42848 [ACK] Seq=457 Ack=698 Win=65535 Len=0"
"127","99.339066","74.125.207.16","10.0.2.15","TLSv1.2","103","Application Data"
"128","99.340010","10.0.2.15","74.125.207.16","TLSv1.2","125","Application Data"
"129","99.340731","74.125.207.16","10.0.2.15","TCP","60","465  >  42848 [ACK] Seq=506 Ack=769 Win=65535 Len=0"
"130","99.393688","74.125.207.16","10.0.2.15","TLSv1.2","123","Application Data"
"131","99.396184","10.0.2.15","74.125.207.16","TLSv1.2","114","Application Data"
"132","99.396444","74.125.207.16","10.0.2.15","TCP","60","465  >  42848 [ACK] Seq=575 Ack=829 Win=65535 Len=0"
"133","99.446359","74.125.207.16","10.0.2.15","TLSv1.2","123","Application Data"
"134","99.458230","10.0.2.15","74.125.207.16","TLSv1.2","89","Application Data"
"135","99.459590","74.125.207.16","10.0.2.15","TCP","60","465  >  42848 [ACK] Seq=644 Ack=864 Win=65535 Len=0"
"136","99.981259","74.125.207.16","10.0.2.15","TLSv1.2","124","Application Data"
"137","100.002848","10.0.2.15","74.125.207.16","TLSv1.2","442","Application Data"
"138","100.003058","10.0.2.15","74.125.207.16","TLSv1.2","86","Application Data"
"139","100.003212","74.125.207.16","10.0.2.15","TCP","60","465  >  42848 [ACK] Seq=714 Ack=1252 Win=65535 Len=0"
"140","100.003980","74.125.207.16","10.0.2.15","TCP","60","465  >  42848 [ACK] Seq=714 Ack=1284 Win=65535 Len=0"
"141","100.751541","10.0.2.15","216.58.208.46","TCP","54","[TCP Keep-Alive] 53913  >  80 [ACK] Seq=435 Ack=780 Win=30381 Len=0"
"142","100.752432","216.58.208.46","10.0.2.15","TCP","60","[TCP Keep-Alive ACK] 80  >  53913 [ACK] Seq=780 Ack=436 Win=65535 Len=0"
"143","100.990542","74.125.207.16","10.0.2.15","TLSv1.2","134","Application Data"
"144","100.991691","10.0.2.15","74.125.207.16","TLSv1.2","89","Application Data"
"145","100.992408","74.125.207.16","10.0.2.15","TCP","60","465  >  42848 [ACK] Seq=794 Ack=1319 Win=65535 Len=0"
"146","101.042576","74.125.207.16","10.0.2.15","TLSv1.2","139","Application Data"
"147","101.043536","74.125.207.16","10.0.2.15","TCP","60","465  >  42848 [FIN, ACK] Seq=879 Ack=1319 Win=65535 Len=0"
"148","101.085666","10.0.2.15","74.125.207.16","TCP","54","42848  >  465 [ACK] Seq=1319 Ack=880 Win=31088 Len=0"
"149","101.106824","10.0.2.15","74.125.207.16","TLSv1.2","85","Encrypted Alert"
"150","101.107090","10.0.2.15","74.125.207.16","TCP","54","42848  >  465 [FIN, ACK] Seq=1350 Ack=880 Win=31088 Len=0"
"151","101.107294","74.125.207.16","10.0.2.15","TCP","60","465  >  42848 [ACK] Seq=880 Ack=1350 Win=65535 Len=0"
"152","101.107489","74.125.207.16","10.0.2.15","TCP","60","465  >  42848 [ACK] Seq=880 Ack=1351 Win=65535 Len=0"
"153","110.230784","10.0.2.15","74.125.207.16","TCP","74","42849  >  465 [SYN] Seq=0 Win=29200 Len=0 MSS=1460 SACK_PERM TSval=4898162 TSecr=0 WS=128"
"154","110.305641","74.125.207.16","10.0.2.15","TCP","60","465  >  42849 [SYN, ACK] Seq=0 Ack=1 Win=65535 Len=0 MSS=1460"
"155","110.305784","10.0.2.15","74.125.207.16","TCP","54","42849  >  465 [ACK] Seq=1 Ack=1 Win=29200 Len=0"
"156","110.307187","10.0.2.15","74.125.207.16","TLSv1.2","571","Client Hello (SNI=smtp.googlemail.com)"
"157","110.307440","74.125.207.16","10.0.2.15","TCP","60","465  >  42849 [ACK] Seq=1 Ack=518 Win=65535 Len=0"
"158","110.356293","74.125.207.16","10.0.2.15","TLSv1.2","191","Server Hello, Change Cipher Spec, Encrypted Handshake Message"
"159","110.356333","10.0.2.15","74.125.207.16","TCP","54","42849  >  465 [ACK] Seq=518 Ack=138 Win=30016 Len=0"
"160","110.356798","10.0.2.15","74.125.207.16","TLSv1.2","105","Change Cipher Spec, Encrypted Handshake Message"
"161","110.357412","74.125.207.16","10.0.2.15","TCP","60","465  >  42849 [ACK] Seq=138 Ack=569 Win=65535 Len=0"
"162","110.408621","74.125.207.16","10.0.2.15","TLSv1.2","134","Application Data"
"163","110.445681","10.0.2.15","74.125.207.16","TCP","54","42849  >  465 [ACK] Seq=569 Ack=218 Win=30016 Len=0"
"164","110.484727","10.0.2.15","74.125.207.16","TLSv1.2","101","Application Data"
"165","110.485507","74.125.207.16","10.0.2.15","TCP","60","465  >  42849 [ACK] Seq=218 Ack=616 Win=65535 Len=0"
"166","110.555848","74.125.207.16","10.0.2.15","TLSv1.2","293","Application Data"
"167","110.556156","10.0.2.15","74.125.207.16","TCP","54","42849  >  465 [ACK] Seq=616 Ack=457 Win=31088 Len=0"
"168","110.614356","10.0.2.15","74.125.207.16","TLSv1.2","136","Application Data"
"169","110.614986","74.125.207.16","10.0.2.15","TCP","60","465  >  42849 [ACK] Seq=457 Ack=698 Win=65535 Len=0"
"170","110.767548","10.0.2.15","216.58.208.46","TCP","54","[TCP Keep-Alive] 53913  >  80 [ACK] Seq=435 Ack=780 Win=30381 Len=0"
"171","110.768622","216.58.208.46","10.0.2.15","TCP","60","[TCP Keep-Alive ACK] 80  >  53913 [ACK] Seq=780 Ack=436 Win=65535 Len=0"
"172","111.177317","74.125.207.16","10.0.2.15","TLSv1.2","103","Application Data"
"173","111.178425","10.0.2.15","74.125.207.16","TCP","54","42849  >  465 [ACK] Seq=698 Ack=506 Win=31088 Len=0"
"174","111.184950","10.0.2.15","74.125.207.16","TLSv1.2","125","Application Data"
"175","111.185423","74.125.207.16","10.0.2.15","TCP","60","465  >  42849 [ACK] Seq=506 Ack=769 Win=65535 Len=0"
"176","111.240762","74.125.207.16","10.0.2.15","TLSv1.2","123","Application Data"
"177","111.241259","10.0.2.15","74.125.207.16","TLSv1.2","114","Application Data"
"178","111.241743","74.125.207.16","10.0.2.15","TCP","60","465  >  42849 [ACK] Seq=575 Ack=829 Win=65535 Len=0"
"179","111.290734","74.125.207.16","10.0.2.15","TLSv1.2","123","Application Data"
"180","111.291923","10.0.2.15","74.125.207.16","TLSv1.2","89","Application Data"
"181","111.292537","74.125.207.16","10.0.2.15","TCP","60","465  >  42849 [ACK] Seq=644 Ack=864 Win=65535 Len=0"
"182","111.809718","74.125.207.16","10.0.2.15","TLSv1.2","124","Application Data"
"183","111.849975","10.0.2.15","74.125.207.16","TCP","54","42849  >  465 [ACK] Seq=864 Ack=714 Win=31088 Len=0"
"184","111.861415","10.0.2.15","74.125.207.16","TLSv1.2","442","Application Data"
"185","111.862968","10.0.2.15","74.125.207.16","TLSv1.2","86","Application Data"
"186","111.863046","74.125.207.16","10.0.2.15","TCP","60","465  >  42849 [ACK] Seq=714 Ack=1252 Win=65535 Len=0"
"187","111.864110","74.125.207.16","10.0.2.15","TCP","60","465  >  42849 [ACK] Seq=714 Ack=1284 Win=65535 Len=0"
"188","112.539425","74.125.207.16","10.0.2.15","TLSv1.2","134","Application Data"
"189","112.539478","10.0.2.15","74.125.207.16","TCP","54","42849  >  465 [ACK] Seq=1284 Ack=794 Win=31088 Len=0"
"190","112.543993","10.0.2.15","74.125.207.16","TLSv1.2","89","Application Data"
"191","112.544336","74.125.207.16","10.0.2.15","TCP","60","465  >  42849 [ACK] Seq=794 Ack=1319 Win=65535 Len=0"
"192","112.604490","74.125.207.16","10.0.2.15","TLSv1.2","139","Application Data"
"193","112.604549","74.125.207.16","10.0.2.15","TCP","60","465  >  42849 [FIN, ACK] Seq=879 Ack=1319 Win=65535 Len=0"
"194","112.642451","10.0.2.15","74.125.207.16","TCP","54","42849  >  465 [ACK] Seq=1319 Ack=880 Win=31088 Len=0"
"195","112.649060","10.0.2.15","74.125.207.16","TLSv1.2","85","Encrypted Alert"
"196","112.649181","10.0.2.15","74.125.207.16","TCP","54","42849  >  465 [FIN, ACK] Seq=1350 Ack=880 Win=31088 Len=0"
"197","112.649635","74.125.207.16","10.0.2.15","TCP","60","465  >  42849 [ACK] Seq=880 Ack=1350 Win=65535 Len=0"
"198","112.649652","74.125.207.16","10.0.2.15","TCP","60","465  >  42849 [ACK] Seq=880 Ack=1351 Win=65535 Len=0"
"199","120.781745","10.0.2.15","216.58.208.46","TCP","54","[TCP Keep-Alive] 53913  >  80 [ACK] Seq=435 Ack=780 Win=30381 Len=0"
"200","120.782060","216.58.208.46","10.0.2.15","TCP","60","[TCP Keep-Alive ACK] 80  >  53913 [ACK] Seq=780 Ack=436 Win=65535 Len=0"
"201","122.667150","10.0.2.15","91.190.218.66","TCP","59","42120  >  12350 [PSH, ACK] Seq=1 Ack=1 Win=31088 Len=5"
"202","122.667592","91.190.218.66","10.0.2.15","TCP","60","12350  >  42120 [ACK] Seq=1 Ack=6 Win=65535 Len=0"
"203","122.797832","91.190.218.66","10.0.2.15","TCP","60","12350  >  42120 [PSH, ACK] Seq=1 Ack=6 Win=65535 Len=5"
"204","122.797865","10.0.2.15","91.190.218.66","TCP","54","42120  >  12350 [ACK] Seq=6 Ack=6 Win=31088 Len=0"
"205","130.799014","10.0.2.15","216.58.208.46","TCP","54","[TCP Keep-Alive] 53913  >  80 [ACK] Seq=435 Ack=780 Win=30381 Len=0"
"206","130.803855","216.58.208.46","10.0.2.15","TCP","60","[TCP Keep-Alive ACK] 80  >  53913 [ACK] Seq=780 Ack=436 Win=65535 Len=0"
"207","135.848595","10.0.2.15","198.7.63.141","DNS","79","Standard query 0x6687 A smtp.googlemail.com"
"208","135.848784","10.0.2.15","78.46.223.24","DNS","79","Standard query 0x6687 A smtp.googlemail.com"
"209","135.849320","10.0.2.15","198.7.63.141","DNS","79","Standard query 0x697b AAAA smtp.googlemail.com"
"210","135.851042","10.0.2.15","74.125.207.16","TCP","74","42850  >  465 [SYN] Seq=0 Win=29200 Len=0 MSS=1460 SACK_PERM TSval=4904567 TSecr=0 WS=128"
"211","135.908195","198.7.63.141","10.0.2.15","DNS","282","Standard query response 0x697b AAAA smtp.googlemail.com CNAME googlemail-smtp.l.google.com AAAA 2607:f8b0:4001:c07::10 NS ns3.google.com NS ns1.google.com NS ns2.google.com NS ns4.google.com A 216.239.32.10 A 216.239.34.10 A 216.239.36.10 A 216.239.38.10"
"212","135.908256","198.7.63.141","10.0.2.15","DNS","270","Standard query response 0x6687 A smtp.googlemail.com CNAME googlemail-smtp.l.google.com A 74.125.207.16 NS ns3.google.com NS ns4.google.com NS ns1.google.com NS ns2.google.com A 216.239.32.10 A 216.239.34.10 A 216.239.36.10 A 216.239.38.10"
"213","135.909298","74.125.207.16","10.0.2.15","TCP","60","465  >  42850 [SYN, ACK] Seq=0 Ack=1 Win=65535 Len=0 MSS=1460"
"214","135.909367","10.0.2.15","74.125.207.16","TCP","54","42850  >  465 [ACK] Seq=1 Ack=1 Win=29200 Len=0"
"215","135.909781","10.0.2.15","74.125.207.16","TLSv1.2","571","Client Hello (SNI=smtp.googlemail.com)"
"216","135.910025","74.125.207.16","10.0.2.15","TCP","60","465  >  42850 [ACK] Seq=1 Ack=518 Win=65535 Len=0"
"217","135.961103","74.125.207.16","10.0.2.15","TLSv1.2","191","Server Hello, Change Cipher Spec, Encrypted Handshake Message"
"218","135.961236","10.0.2.15","74.125.207.16","TCP","54","42850  >  465 [ACK] Seq=518 Ack=138 Win=30016 Len=0"
"219","135.966274","10.0.2.15","74.125.207.16","TLSv1.2","105","Change Cipher Spec, Encrypted Handshake Message"
"220","135.966643","74.125.207.16","10.0.2.15","TCP","60","465  >  42850 [ACK] Seq=138 Ack=569 Win=65535 Len=0"
"221","135.999055","78.46.223.24","10.0.2.15","DNS","270","Standard query response 0x6687 A smtp.googlemail.com CNAME googlemail-smtp.l.google.com A 74.125.206.16 NS ns1.google.com NS ns2.google.com NS ns3.google.com NS ns4.google.com A 216.239.32.10 A 216.239.34.10 A 216.239.36.10 A 216.239.38.10"
"222","135.999191","10.0.2.15","78.46.223.24","ICMP","298","Destination unreachable (Port unreachable)"
"223","136.172997","74.125.207.16","10.0.2.15","TLSv1.2","133","Application Data"
"224","136.175225","10.0.2.15","74.125.207.16","TLSv1.2","101","Application Data"
"225","136.175441","74.125.207.16","10.0.2.15","TCP","60","465  >  42850 [ACK] Seq=217 Ack=616 Win=65535 Len=0"
"226","136.227732","74.125.207.16","10.0.2.15","TLSv1.2","293","Application Data"
"227","136.232894","10.0.2.15","74.125.207.16","TLSv1.2","136","Application Data"
"228","136.233658","74.125.207.16","10.0.2.15","TCP","60","465  >  42850 [ACK] Seq=456 Ack=698 Win=65535 Len=0"
"229","136.775503","74.125.207.16","10.0.2.15","TLSv1.2","103","Application Data"
"230","136.776400","10.0.2.15","74.125.207.16","TLSv1.2","125","Application Data"
"231","136.776677","74.125.207.16","10.0.2.15","TCP","60","465  >  42850 [ACK] Seq=505 Ack=769 Win=65535 Len=0"
"232","136.824874","74.125.207.16","10.0.2.15","TLSv1.2","122","Application Data"
"233","136.825457","10.0.2.15","74.125.207.16","TLSv1.2","114","Application Data"
"234","136.825936","74.125.207.16","10.0.2.15","TCP","60","465  >  42850 [ACK] Seq=573 Ack=829 Win=65535 Len=0"
"235","136.873676","74.125.207.16","10.0.2.15","TLSv1.2","122","Application Data"
"236","136.874783","10.0.2.15","74.125.207.16","TLSv1.2","89","Application Data"
"237","136.876917","74.125.207.16","10.0.2.15","TCP","60","465  >  42850 [ACK] Seq=641 Ack=864 Win=65535 Len=0"
"238","137.394553","74.125.207.16","10.0.2.15","TLSv1.2","123","Application Data"
"239","137.401988","10.0.2.15","74.125.207.16","TLSv1.2","442","Application Data"
"240","137.402504","74.125.207.16","10.0.2.15","TCP","60","465  >  42850 [ACK] Seq=710 Ack=1252 Win=65535 Len=0"
"241","137.402900","10.0.2.15","74.125.207.16","TLSv1.2","86","Application Data"
"242","137.403140","74.125.207.16","10.0.2.15","TCP","60","465  >  42850 [ACK] Seq=710 Ack=1284 Win=65535 Len=0"
"243","138.376481","74.125.207.16","10.0.2.15","TLSv1.2","133","Application Data"
"244","138.377195","10.0.2.15","74.125.207.16","TLSv1.2","89","Application Data"
"245","138.377506","74.125.207.16","10.0.2.15","TCP","60","465  >  42850 [ACK] Seq=789 Ack=1319 Win=65535 Len=0"
"246","138.428817","74.125.207.16","10.0.2.15","TLSv1.2","138","Application Data"
"247","138.428837","74.125.207.16","10.0.2.15","TCP","60","465  >  42850 [FIN, ACK] Seq=873 Ack=1319 Win=65535 Len=0"
"248","138.465676","10.0.2.15","74.125.207.16","TCP","54","42850  >  465 [ACK] Seq=1319 Ack=874 Win=31088 Len=0"
"249","138.476339","10.0.2.15","74.125.207.16","TLSv1.2","85","Encrypted Alert"
"250","138.476707","74.125.207.16","10.0.2.15","TCP","60","465  >  42850 [ACK] Seq=874 Ack=1350 Win=65535 Len=0"
"251","138.476767","10.0.2.15","74.125.207.16","TCP","54","42850  >  465 [FIN, ACK] Seq=1350 Ack=874 Win=31088 Len=0"
"252","138.476954","74.125.207.16","10.0.2.15","TCP","60","465  >  42850 [ACK] Seq=874 Ack=1351 Win=65535 Len=0"
"253","140.815151","10.0.2.15","216.58.208.46","TCP","54","[TCP Keep-Alive] 53913  >  80 [ACK] Seq=435 Ack=780 Win=30381 Len=0"
"254","140.815732","216.58.208.46","10.0.2.15","TCP","60","[TCP Keep-Alive ACK] 80  >  53913 [ACK] Seq=780 Ack=436 Win=65535 Len=0"
"255","147.866905","10.0.2.15","74.125.207.16","TCP","74","42851  >  465 [SYN] Seq=0 Win=29200 Len=0 MSS=1460 SACK_PERM TSval=4907571 TSecr=0 WS=128"
"256","147.921062","74.125.207.16","10.0.2.15","TCP","60","465  >  42851 [SYN, ACK] Seq=0 Ack=1 Win=65535 Len=0 MSS=1460"
"257","147.921206","10.0.2.15","74.125.207.16","TCP","54","42851  >  465 [ACK] Seq=1 Ack=1 Win=29200 Len=0"
"258","147.921627","10.0.2.15","74.125.207.16","TLSv1.2","571","Client Hello (SNI=smtp.googlemail.com)"
"259","147.921873","74.125.207.16","10.0.2.15","TCP","60","465  >  42851 [ACK] Seq=1 Ack=518 Win=65535 Len=0"
"260","147.972316","74.125.207.16","10.0.2.15","TLSv1.2","191","Server Hello, Change Cipher Spec, Encrypted Handshake Message"
"261","147.972353","10.0.2.15","74.125.207.16","TCP","54","42851  >  465 [ACK] Seq=518 Ack=138 Win=30016 Len=0"
"262","147.973269","10.0.2.15","74.125.207.16","TLSv1.2","105","Change Cipher Spec, Encrypted Handshake Message"
"263","147.973468","74.125.207.16","10.0.2.15","TCP","60","465  >  42851 [ACK] Seq=138 Ack=569 Win=65535 Len=0"
"264","148.327503","74.125.207.16","10.0.2.15","TLSv1.2","134","Application Data"
"265","148.335923","10.0.2.15","74.125.207.16","TLSv1.2","101","Application Data"
"266","148.336809","74.125.207.16","10.0.2.15","TCP","60","465  >  42851 [ACK] Seq=218 Ack=616 Win=65535 Len=0"
"267","148.392753","74.125.207.16","10.0.2.15","TLSv1.2","293","Application Data"
"268","148.410457","10.0.2.15","74.125.207.16","TLSv1.2","136","Application Data"
"269","148.410804","74.125.207.16","10.0.2.15","TCP","60","465  >  42851 [ACK] Seq=457 Ack=698 Win=65535 Len=0"
"270","148.941711","74.125.207.16","10.0.2.15","TLSv1.2","103","Application Data"
"271","148.942068","10.0.2.15","74.125.207.16","TLSv1.2","125","Application Data"
"272","148.942523","74.125.207.16","10.0.2.15","TCP","60","465  >  42851 [ACK] Seq=506 Ack=769 Win=65535 Len=0"
"273","148.998641","74.125.207.16","10.0.2.15","TLSv1.2","123","Application Data"
"274","149.005940","10.0.2.15","74.125.207.16","TLSv1.2","114","Application Data"
"275","149.006343","74.125.207.16","10.0.2.15","TCP","60","465  >  42851 [ACK] Seq=575 Ack=829 Win=65535 Len=0"
"276","149.057877","74.125.207.16","10.0.2.15","TLSv1.2","123","Application Data"
"277","149.058576","10.0.2.15","74.125.207.16","TLSv1.2","89","Application Data"
"278","149.059286","74.125.207.16","10.0.2.15","TCP","60","465  >  42851 [ACK] Seq=644 Ack=864 Win=65535 Len=0"
"279","149.582718","74.125.207.16","10.0.2.15","TLSv1.2","124","Application Data"
"280","149.592471","10.0.2.15","74.125.207.16","TLSv1.2","442","Application Data"
"281","149.592626","10.0.2.15","74.125.207.16","TLSv1.2","86","Application Data"
"282","149.593438","74.125.207.16","10.0.2.15","TCP","60","465  >  42851 [ACK] Seq=714 Ack=1252 Win=65535 Len=0"
"283","149.593454","74.125.207.16","10.0.2.15","TCP","60","465  >  42851 [ACK] Seq=714 Ack=1284 Win=65535 Len=0"
"284","150.565684","74.125.207.16","10.0.2.15","TLSv1.2","134","Application Data"
"285","150.567477","10.0.2.15","74.125.207.16","TLSv1.2","89","Application Data"
"286","150.568090","74.125.207.16","10.0.2.15","TCP","60","465  >  42851 [ACK] Seq=794 Ack=1319 Win=65535 Len=0"
"287","150.626104","74.125.207.16","10.0.2.15","TLSv1.2","139","Application Data"
"288","150.626575","74.125.207.16","10.0.2.15","TCP","60","465  >  42851 [FIN, ACK] Seq=879 Ack=1319 Win=65535 Len=0"
"289","150.669629","10.0.2.15","74.125.207.16","TCP","54","42851  >  465 [ACK] Seq=1319 Ack=880 Win=31088 Len=0"
"290","150.681519","10.0.2.15","74.125.207.16","TLSv1.2","85","Encrypted Alert"
"291","150.681643","10.0.2.15","74.125.207.16","TCP","54","42851  >  465 [FIN, ACK] Seq=1350 Ack=880 Win=31088 Len=0"
"292","150.681998","74.125.207.16","10.0.2.15","TCP","60","465  >  42851 [ACK] Seq=880 Ack=1350 Win=65535 Len=0"
"293","150.682014","74.125.207.16","10.0.2.15","TCP","60","465  >  42851 [ACK] Seq=880 Ack=1351 Win=65535 Len=0"
"294","150.830836","10.0.2.15","216.58.208.46","TCP","54","[TCP Keep-Alive] 53913  >  80 [ACK] Seq=435 Ack=780 Win=30381 Len=0"
"295","150.831742","216.58.208.46","10.0.2.15","TCP","60","[TCP Keep-Alive ACK] 80  >  53913 [ACK] Seq=780 Ack=436 Win=65535 Len=0"
"296","160.846785","10.0.2.15","216.58.208.46","TCP","54","[TCP Keep-Alive] 53913  >  80 [ACK] Seq=435 Ack=780 Win=30381 Len=0"
"297","160.847186","216.58.208.46","10.0.2.15","TCP","60","[TCP Keep-Alive ACK] 80  >  53913 [ACK] Seq=780 Ack=436 Win=65535 Len=0"
"298","161.060264","10.0.2.15","74.125.207.16","TCP","74","42852  >  465 [SYN] Seq=0 Win=29200 Len=0 MSS=1460 SACK_PERM TSval=4910869 TSecr=0 WS=128"
"299","161.116554","74.125.207.16","10.0.2.15","TCP","60","465  >  42852 [SYN, ACK] Seq=0 Ack=1 Win=65535 Len=0 MSS=1460"
"300","161.116715","10.0.2.15","74.125.207.16","TCP","54","42852  >  465 [ACK] Seq=1 Ack=1 Win=29200 Len=0"
"301","161.117037","10.0.2.15","74.125.207.16","TLSv1.2","571","Client Hello (SNI=smtp.googlemail.com)"
"302","161.117336","74.125.207.16","10.0.2.15","TCP","60","465  >  42852 [ACK] Seq=1 Ack=518 Win=65535 Len=0"
"303","161.169668","74.125.207.16","10.0.2.15","TLSv1.2","191","Server Hello, Change Cipher Spec, Encrypted Handshake Message"
"304","161.169788","10.0.2.15","74.125.207.16","TCP","54","42852  >  465 [ACK] Seq=518 Ack=138 Win=30016 Len=0"
"305","161.174789","10.0.2.15","74.125.207.16","TLSv1.2","105","Change Cipher Spec, Encrypted Handshake Message"
"306","161.175347","74.125.207.16","10.0.2.15","TCP","60","465  >  42852 [ACK] Seq=138 Ack=569 Win=65535 Len=0"
"307","161.229417","74.125.207.16","10.0.2.15","TLSv1.2","133","Application Data"
"308","161.265642","10.0.2.15","74.125.207.16","TCP","54","42852  >  465 [ACK] Seq=569 Ack=217 Win=30016 Len=0"
"309","161.271144","10.0.2.15","74.125.207.16","TLSv1.2","101","Application Data"
"310","161.271612","74.125.207.16","10.0.2.15","TCP","60","465  >  42852 [ACK] Seq=217 Ack=616 Win=65535 Len=0"
"311","161.328697","74.125.207.16","10.0.2.15","TLSv1.2","293","Application Data"
"312","161.328760","10.0.2.15","74.125.207.16","TCP","54","42852  >  465 [ACK] Seq=616 Ack=456 Win=31088 Len=0"
"313","161.366513","10.0.2.15","74.125.207.16","TLSv1.2","136","Application Data"
"314","161.366987","74.125.207.16","10.0.2.15","TCP","60","465  >  42852 [ACK] Seq=456 Ack=698 Win=65535 Len=0"
"315","161.894195","74.125.207.16","10.0.2.15","TLSv1.2","103","Application Data"
"316","161.894689","10.0.2.15","74.125.207.16","TCP","54","42852  >  465 [ACK] Seq=698 Ack=505 Win=31088 Len=0"
"317","161.906392","10.0.2.15","74.125.207.16","TLSv1.2","125","Application Data"
"318","161.907063","74.125.207.16","10.0.2.15","TCP","60","465  >  42852 [ACK] Seq=505 Ack=769 Win=65535 Len=0"
"319","161.959526","74.125.207.16","10.0.2.15","TLSv1.2","122","Application Data"
"320","161.960225","10.0.2.15","74.125.207.16","TLSv1.2","114","Application Data"
"321","161.961855","74.125.207.16","10.0.2.15","TCP","60","465  >  42852 [ACK] Seq=573 Ack=829 Win=65535 Len=0"
"322","162.008930","74.125.207.16","10.0.2.15","TLSv1.2","122","Application Data"
"323","162.009751","10.0.2.15","74.125.207.16","TLSv1.2","89","Application Data"
"324","162.009947","74.125.207.16","10.0.2.15","TCP","60","465  >  42852 [ACK] Seq=641 Ack=864 Win=65535 Len=0"
"325","162.535039","74.125.207.16","10.0.2.15","TLSv1.2","123","Application Data"
"326","162.541958","10.0.2.15","74.125.207.16","TLSv1.2","440","Application Data"
"327","162.542218","10.0.2.15","74.125.207.16","TLSv1.2","86","Application Data"
"328","162.542290","74.125.207.16","10.0.2.15","TCP","60","465  >  42852 [ACK] Seq=710 Ack=1250 Win=65535 Len=0"
"329","162.542421","74.125.207.16","10.0.2.15","TCP","60","465  >  42852 [ACK] Seq=710 Ack=1282 Win=65535 Len=0"
"330","163.537725","74.125.207.16","10.0.2.15","TLSv1.2","133","Application Data"
"331","163.539419","10.0.2.15","74.125.207.16","TLSv1.2","89","Application Data"
"332","163.540012","74.125.207.16","10.0.2.15","TCP","60","465  >  42852 [ACK] Seq=789 Ack=1317 Win=65535 Len=0"
"333","163.588242","74.125.207.16","10.0.2.15","TLSv1.2","138","Application Data"
"334","163.588279","74.125.207.16","10.0.2.15","TCP","60","465  >  42852 [FIN, ACK] Seq=873 Ack=1317 Win=65535 Len=0"
"335","163.627121","10.0.2.15","74.125.207.16","TCP","54","42852  >  465 [ACK] Seq=1317 Ack=874 Win=31088 Len=0"
"336","163.656472","10.0.2.15","74.125.207.16","TLSv1.2","85","Encrypted Alert"
"337","163.656758","10.0.2.15","74.125.207.16","TCP","54","42852  >  465 [FIN, ACK] Seq=1348 Ack=874 Win=31088 Len=0"
"338","163.657018","74.125.207.16","10.0.2.15","TCP","60","465  >  42852 [ACK] Seq=874 Ack=1348 Win=65535 Len=0"
"339","163.657035","74.125.207.16","10.0.2.15","TCP","60","465  >  42852 [ACK] Seq=874 Ack=1349 Win=65535 Len=0"
"340","170.862127","10.0.2.15","216.58.208.46","TCP","54","[TCP Keep-Alive] 53913  >  80 [ACK] Seq=435 Ack=780 Win=30381 Len=0"
"341","170.862887","216.58.208.46","10.0.2.15","TCP","60","[TCP Keep-Alive ACK] 80  >  53913 [ACK] Seq=780 Ack=436 Win=65535 Len=0"
"342","172.866116","10.0.2.15","74.125.207.16","TCP","74","42853  >  465 [SYN] Seq=0 Win=29200 Len=0 MSS=1460 SACK_PERM TSval=4913821 TSecr=0 WS=128"
"343","172.919370","74.125.207.16","10.0.2.15","TCP","60","465  >  42853 [SYN, ACK] Seq=0 Ack=1 Win=65535 Len=0 MSS=1460"
"344","172.919538","10.0.2.15","74.125.207.16","TCP","54","42853  >  465 [ACK] Seq=1 Ack=1 Win=29200 Len=0"
"345","172.919919","10.0.2.15","74.125.207.16","TLSv1.2","571","Client Hello (SNI=smtp.googlemail.com)"
"346","172.920362","74.125.207.16","10.0.2.15","TCP","60","465  >  42853 [ACK] Seq=1 Ack=518 Win=65535 Len=0"
"347","172.978313","74.125.207.16","10.0.2.15","TLSv1.2","191","Server Hello, Change Cipher Spec, Encrypted Handshake Message"
"348","172.978443","10.0.2.15","74.125.207.16","TCP","54","42853  >  465 [ACK] Seq=518 Ack=138 Win=30016 Len=0"
"349","172.982663","10.0.2.15","74.125.207.16","TLSv1.2","105","Change Cipher Spec, Encrypted Handshake Message"
"350","172.983132","74.125.207.16","10.0.2.15","TCP","60","465  >  42853 [ACK] Seq=138 Ack=569 Win=65535 Len=0"
"351","173.296640","74.125.207.16","10.0.2.15","TLSv1.2","134","Application Data"
"352","173.315404","10.0.2.15","74.125.207.16","TLSv1.2","101","Application Data"
"353","173.315800","74.125.207.16","10.0.2.15","TCP","60","465  >  42853 [ACK] Seq=218 Ack=616 Win=65535 Len=0"
"354","173.368535","74.125.207.16","10.0.2.15","TLSv1.2","293","Application Data"
"355","173.375120","10.0.2.15","74.125.207.16","TLSv1.2","136","Application Data"
"356","173.375660","74.125.207.16","10.0.2.15","TCP","60","465  >  42853 [ACK] Seq=457 Ack=698 Win=65535 Len=0"
"357","173.919534","74.125.207.16","10.0.2.15","TLSv1.2","103","Application Data"
"358","173.929276","10.0.2.15","74.125.207.16","TLSv1.2","125","Application Data"
"359","173.929635","74.125.207.16","10.0.2.15","TCP","60","465  >  42853 [ACK] Seq=506 Ack=769 Win=65535 Len=0"
"360","173.977727","74.125.207.16","10.0.2.15","TLSv1.2","123","Application Data"
"361","173.995340","10.0.2.15","74.125.207.16","TLSv1.2","114","Application Data"
"362","173.995738","74.125.207.16","10.0.2.15","TCP","60","465  >  42853 [ACK] Seq=575 Ack=829 Win=65535 Len=0"
"363","174.045469","74.125.207.16","10.0.2.15","TLSv1.2","123","Application Data"
"364","174.046244","10.0.2.15","74.125.207.16","TLSv1.2","89","Application Data"
"365","174.046455","74.125.207.16","10.0.2.15","TCP","60","465  >  42853 [ACK] Seq=644 Ack=864 Win=65535 Len=0"
"366","174.660750","74.125.207.16","10.0.2.15","TLSv1.2","124","Application Data"
"367","174.697689","10.0.2.15","74.125.207.16","TCP","54","42853  >  465 [ACK] Seq=864 Ack=714 Win=31088 Len=0"
"368","174.702630","10.0.2.15","74.125.207.16","TLSv1.2","445","Application Data"
"369","174.702922","74.125.207.16","10.0.2.15","TCP","60","465  >  42853 [ACK] Seq=714 Ack=1255 Win=65535 Len=0"
"370","175.879559","74.125.207.16","10.0.2.15","TLSv1.2","134","Application Data"
"371","175.879639","10.0.2.15","74.125.207.16","TCP","54","42853  >  465 [ACK] Seq=1255 Ack=794 Win=31088 Len=0"
"372","175.880430","10.0.2.15","74.125.207.16","TLSv1.2","89","Application Data"
