"No.","Time","Source","Destination","Protocol","Length","Info"
"1","0.000000","10.8.8.110","199.233.217.27","NTP","76","NTP Version 4, client"
"2","0.267490","199.233.217.27","10.8.8.110","NTP","76","NTP Version 4, server"
"3","5.306131","10.8.8.110","216.58.208.46","TCP","52","33063  >  80 [ACK] Seq=1 Ack=1 Win=241 Len=0 TSval=65688 TSecr=296438506"
"4","5.427182","216.58.208.46","10.8.8.110","TCP","52","[TCP ACKed unseen segment] 80  >  33063 [ACK] Seq=1 Ack=2 Win=341 Len=0 TSval=296448652 TSecr=55580"
"5","15.448383","10.8.8.110","216.58.208.46","TCP","52","[TCP Dup ACK 3#1] 33063  >  80 [ACK] Seq=1 Ack=1 Win=241 Len=0 TSval=68224 TSecr=296448652"
"6","15.570617","216.58.208.46","10.8.8.110","TCP","52","[TCP Dup ACK 4#1] 80  >  33063 [ACK] Seq=1 Ack=2 Win=341 Len=0 TSval=296458795 TSecr=55580"
"7","25.593728","10.8.8.110","216.58.208.46","TCP","52","[TCP Dup ACK 3#2] 33063  >  80 [ACK] Seq=1 Ack=1 Win=241 Len=0 TSval=70760 TSecr=296458795"
"8","25.713951","216.58.208.46","10.8.8.110","TCP","52","[TCP Dup ACK 4#2] 80  >  33063 [ACK] Seq=1 Ack=2 Win=341 Len=0 TSval=296468941 TSecr=55580"
"9","35.737038","10.8.8.110","216.58.208.46","TCP","52","[TCP Dup ACK 3#3] 33063  >  80 [ACK] Seq=1 Ack=1 Win=241 Len=0 TSval=73296 TSecr=296468941"
"10","35.858926","216.58.208.46","10.8.8.110","TCP","52","[TCP Dup ACK 4#3] 80  >  33063 [ACK] Seq=1 Ack=2 Win=341 Len=0 TSval=296479085 TSecr=55580"
"11","45.881861","10.8.8.110","216.58.208.46","TCP","52","[TCP Dup ACK 3#4] 33063  >  80 [ACK] Seq=1 Ack=1 Win=241 Len=0 TSval=75832 TSecr=296479085"
"12","46.002585","216.58.208.46","10.8.8.110","TCP","52","[TCP Dup ACK 4#4] 80  >  33063 [ACK] Seq=1 Ack=2 Win=341 Len=0 TSval=296489230 TSecr=55580"
"13","56.024429","10.8.8.110","216.58.208.46","TCP","52","[TCP Dup ACK 3#5] 33063  >  80 [ACK] Seq=1 Ack=1 Win=241 Len=0 TSval=78368 TSecr=296489230"
"14","56.146050","216.58.208.46","10.8.8.110","TCP","52","[TCP Dup ACK 4#5] 80  >  33063 [ACK] Seq=1 Ack=2 Win=341 Len=0 TSval=296499374 TSecr=55580"
"15","66.168105","10.8.8.110","216.58.208.46","TCP","52","[TCP Dup ACK 3#6] 33063  >  80 [ACK] Seq=1 Ack=1 Win=241 Len=0 TSval=80904 TSecr=296499374"
"16","66.289992","216.58.208.46","10.8.8.110","TCP","52","[TCP Dup ACK 4#6] 80  >  33063 [ACK] Seq=1 Ack=2 Win=341 Len=0 TSval=296509518 TSecr=55580"
"17","76.313023","10.8.8.110","216.58.208.46","TCP","52","[TCP Dup ACK 3#7] 33063  >  80 [ACK] Seq=1 Ack=1 Win=241 Len=0 TSval=83440 TSecr=296509518"
"18","76.437399","216.58.208.46","10.8.8.110","TCP","52","[TCP Dup ACK 4#7] 80  >  33063 [ACK] Seq=1 Ack=2 Win=341 Len=0 TSval=296519663 TSecr=55580"
"19","80.443747","10.8.8.110","216.58.208.46","TCP","52","[TCP Previous segment not captured] 33063  >  80 [FIN, ACK] Seq=2 Ack=1 Win=241 Len=0 TSval=84472 TSecr=296519663"
"20","80.567225","216.58.208.46","10.8.8.110","TCP","52","80  >  33063 [FIN, ACK] Seq=1 Ack=3 Win=341 Len=0 TSval=296523795 TSecr=84472"
"21","80.567274","10.8.8.110","216.58.208.46","TCP","52","33063  >  80 [ACK] Seq=3 Ack=2 Win=241 Len=0 TSval=84503 TSecr=296523795"
"22","102.068965","10.8.8.110","198.7.63.141","DNS","65","Standard query 0x438d A smtp.googlemail.com"
"23","102.069005","10.8.8.110","78.46.223.24","DNS","65","Standard query 0x438d A smtp.googlemail.com"
"24","102.069670","10.8.8.110","198.7.63.141","DNS","65","Standard query 0xff32 AAAA smtp.googlemail.com"
"25","102.211623","198.7.63.141","10.8.8.110","DNS","256","Standard query response 0x438d A smtp.googlemail.com CNAME googlemail-smtp.l.google.com A 64.233.184.16 NS ns2.google.com NS ns1.google.com NS ns3.google.com NS ns4.google.com A 216.239.32.10 A 216.239.34.10 A 216.239.36.10 A 216.239.38.10"
"26","102.211683","78.46.223.24","10.8.8.110","DNS","256","Standard query response 0x438d A smtp.googlemail.com CNAME googlemail-smtp.l.google.com A 64.233.184.16 NS ns2.google.com NS ns1.google.com NS ns4.google.com NS ns3.google.com A 216.239.32.10 A 216.239.34.10 A 216.239.36.10 A 216.239.38.10"
"27","102.211702","198.7.63.141","10.8.8.110","DNS","268","Standard query response 0xff32 AAAA smtp.googlemail.com CNAME googlemail-smtp.l.google.com AAAA 2a00:1450:400c:c0b::10 NS ns1.google.com NS ns3.google.com NS ns2.google.com NS ns4.google.com A 216.239.32.10 A 216.239.34.10 A 216.239.36.10 A 216.239.38.10"
"28","102.212973","10.8.8.110","64.233.184.16","TCP","60","37386  >  465 [SYN] Seq=0 Win=29200 Len=0 MSS=1460 SACK_PERM TSval=89915 TSecr=0 WS=128"
"29","102.344748","64.233.184.16","10.8.8.110","TCP","60","465  >  37386 [SYN, ACK] Seq=0 Ack=1 Win=42540 Len=0 MSS=1320 SACK_PERM TSval=267244383 TSecr=89915 WS=128"
"30","102.344823","10.8.8.110","64.233.184.16","TCP","52","37386  >  465 [ACK] Seq=1 Ack=1 Win=29312 Len=0 TSval=89948 TSecr=267244383"
"31","102.345149","10.8.8.110","64.233.184.16","TLSv1.2","234","Client Hello (SNI=smtp.googlemail.com)"
"32","102.475379","64.233.184.16","10.8.8.110","TCP","52","465  >  37386 [ACK] Seq=1 Ack=183 Win=43648 Len=0 TSval=267244515 TSecr=89948"
"33","102.480205","64.233.184.16","10.8.8.110","TLSv1.2","1360","Server Hello"
"34","102.480244","10.8.8.110","64.233.184.16","TCP","52","37386  >  465 [ACK] Seq=183 Ack=1309 Win=32128 Len=0 TSval=89982 TSecr=267244518"
"35","102.480291","64.233.184.16","10.8.8.110","TCP","1360","465  >  37386 [ACK] Seq=1309 Ack=183 Win=43648 Len=1308 TSval=267244518 TSecr=89948 [TCP segment of a reassembled PDU]"
"36","102.480303","10.8.8.110","64.233.184.16","TCP","52","37386  >  465 [ACK] Seq=183 Ack=2617 Win=35072 Len=0 TSval=89982 TSecr=267244518"
"37","102.480325","64.233.184.16","10.8.8.110","TLSv1.2","939","Certificate, Server Key Exchange, Server Hello Done"
"38","102.480334","10.8.8.110","64.233.184.16","TCP","52","37386  >  465 [ACK] Seq=183 Ack=3504 Win=37632 Len=0 TSval=89982 TSecr=267244518"
"39","102.484576","10.8.8.110","64.233.184.16","TLSv1.2","178","Client Key Exchange, Change Cipher Spec, Encrypted Handshake Message"
"40","102.490875","10.8.8.110","198.7.63.141","DNS","65","Standard query 0xf46d A clients1.google.com"
"41","102.490928","10.8.8.110","198.7.63.141","DNS","65","Standard query 0xdfe0 A clients1.google.com"
"42","102.490976","10.8.8.110","198.7.63.141","DNS","65","Standard query 0xb7d9 AAAA clients1.google.com"
"43","102.491084","10.8.8.110","216.58.208.46","TCP","60","33072  >  80 [SYN] Seq=0 Win=29200 Len=0 MSS=1460 SACK_PERM TSval=89984 TSecr=0 WS=128"
"44","102.612748","198.7.63.141","10.8.8.110","DNS","241","Standard query response 0xf46d A clients1.google.com CNAME clients.l.google.com A 216.58.208.46 NS ns4.google.com NS ns2.google.com NS ns1.google.com NS ns3.google.com A 216.239.32.10 A 216.239.34.10 A 216.239.36.10 A 216.239.38.10"
"45","102.612944","198.7.63.141","10.8.8.110","DNS","241","Standard query response 0xdfe0 A clients1.google.com CNAME clients.l.google.com A 216.58.208.46 NS ns4.google.com NS ns3.google.com NS ns2.google.com NS ns1.google.com A 216.239.32.10 A 216.239.34.10 A 216.239.36.10 A 216.239.38.10"
"46","102.612983","216.58.208.46","10.8.8.110","TCP","60","80  >  33072 [SYN, ACK] Seq=0 Ack=1 Win=42540 Len=0 MSS=1320 SACK_PERM TSval=298743073 TSecr=89984 WS=128"
"47","102.613041","10.8.8.110","216.58.208.46","TCP","52","33072  >  80 [ACK] Seq=1 Ack=1 Win=29312 Len=0 TSval=90015 TSecr=298743073"
"48","102.613391","10.8.8.110","216.58.208.46","OCSP","487","Request"
"49","102.617728","64.233.184.16","10.8.8.110","TLSv1.2","298","New Session Ticket, Change Cipher Spec, Encrypted Handshake Message"
"50","102.622849","198.7.63.141","10.8.8.110","DNS","253","Standard query response 0xb7d9 AAAA clients1.google.com CNAME clients.l.google.com AAAA 2a00:1450:4009:80d::200e NS ns2.google.com NS ns4.google.com NS ns3.google.com NS ns1.google.com A 216.239.32.10 A 216.239.34.10 A 216.239.36.10 A 216.239.38.10"
"51","102.656152","10.8.8.110","64.233.184.16","TCP","52","37386  >  465 [ACK] Seq=309 Ack=3750 Win=40320 Len=0 TSval=90026 TSecr=267244658"
"52","102.666183","64.233.184.16","10.8.8.110","TLSv1.2","133","Application Data"
"53","102.666213","10.8.8.110","64.233.184.16","TCP","52","37386  >  465 [ACK] Seq=309 Ack=3831 Win=40320 Len=0 TSval=90028 TSecr=267244705"
"54","102.734693","216.58.208.46","10.8.8.110","TCP","52","80  >  33072 [ACK] Seq=1 Ack=436 Win=43648 Len=0 TSval=298743195 TSecr=90015"
"55","102.748208","216.58.208.46","10.8.8.110","OCSP","831","Response"
"56","102.748240","10.8.8.110","216.58.208.46","TCP","52","33072  >  80 [ACK] Seq=436 Ack=780 Win=30848 Len=0 TSval=90049 TSecr=298743201"
"57","102.758776","10.8.8.110","64.233.184.16","TLSv1.2","100","Application Data"
"58","102.896227","64.233.184.16","10.8.8.110","TLSv1.2","290","Application Data"
"59","102.896256","10.8.8.110","64.233.184.16","TCP","52","37386  >  465 [ACK] Seq=357 Ack=4069 Win=42880 Len=0 TSval=90086 TSecr=267244935"
"60","102.899704","10.8.8.110","64.233.184.16","TLSv1.2","134","Application Data"
"61","103.072994","64.233.184.16","10.8.8.110","TCP","52","465  >  37386 [ACK] Seq=4069 Ack=439 Win=43648 Len=0 TSval=267245111 TSecr=90086"
"62","103.256318","64.233.184.16","10.8.8.110","TLSv1.2","101","Application Data"
"63","103.257836","10.8.8.110","64.233.184.16","TLSv1.2","123","Application Data"
"64","103.387636","64.233.184.16","10.8.8.110","TCP","52","465  >  37386 [ACK] Seq=4118 Ack=510 Win=43648 Len=0 TSval=267245428 TSecr=90176"
"65","103.388150","64.233.184.16","10.8.8.110","TLSv1.2","122","Application Data"
"66","103.392984","10.8.8.110","64.233.184.16","TLSv1.2","112","Application Data"
"67","103.524861","64.233.184.16","10.8.8.110","TLSv1.2","122","Application Data"
"68","103.525165","10.8.8.110","64.233.184.16","TLSv1.2","87","Application Data"
"69","103.697060","64.233.184.16","10.8.8.110","TCP","52","465  >  37386 [ACK] Seq=4258 Ack=605 Win=43648 Len=0 TSval=267245735 TSecr=90243"
"70","103.797245","64.233.184.16","10.8.8.110","TLSv1.2","123","Application Data"
"71","103.798606","10.8.8.110","64.233.184.16","TLSv1.2","443","Application Data"
"72","103.799254","10.8.8.110","64.233.184.16","TLSv1.2","84","Application Data"
"73","103.929248","64.233.184.16","10.8.8.110","TCP","52","465  >  37386 [ACK] Seq=4329 Ack=996 Win=44800 Len=0 TSval=267245968 TSecr=90311"
"74","103.929282","64.233.184.16","10.8.8.110","TCP","52","465  >  37386 [ACK] Seq=4329 Ack=1028 Win=44800 Len=0 TSval=267245969 TSecr=90311"
"75","105.017678","64.233.184.16","10.8.8.110","TLSv1.2","133","Application Data"
"76","105.034128","10.8.8.110","64.233.184.16","TLSv1.2","87","Application Data"
"77","105.166951","64.233.184.16","10.8.8.110","TCP","52","465  >  37386 [ACK] Seq=4410 Ack=1063 Win=44800 Len=0 TSval=267247204 TSecr=90620"
"78","105.167001","64.233.184.16","10.8.8.110","TLSv1.2","138","Application Data"
"79","105.167028","64.233.184.16","10.8.8.110","TCP","52","465  >  37386 [FIN, ACK] Seq=4496 Ack=1063 Win=44800 Len=0 TSval=267247205 TSecr=90620"
"80","105.204078","10.8.8.110","64.233.184.16","TCP","52","37386  >  465 [ACK] Seq=1063 Ack=4497 Win=42880 Len=0 TSval=90663 TSecr=267247205"
"81","105.244149","10.8.8.110","64.233.184.16","TLSv1.2","83","Encrypted Alert"
"82","105.244174","10.8.8.110","64.233.184.16","TCP","52","37386  >  465 [FIN, ACK] Seq=1094 Ack=4497 Win=42880 Len=0 TSval=90673 TSecr=267247205"
"83","105.376068","64.233.184.16","10.8.8.110","TCP","40","465  >  37386 [RST] Seq=4497 Win=0 Len=0"
"84","105.376210","64.233.184.16","10.8.8.110","TCP","40","465  >  37386 [RST] Seq=4497 Win=0 Len=0"
"85","112.748155","10.8.8.110","216.58.208.46","TCP","52","[TCP Keep-Alive] 33072  >  80 [ACK] Seq=435 Ack=780 Win=30848 Len=0 TSval=92549 TSecr=298743201"
"86","112.871747","216.58.208.46","10.8.8.110","TCP","52","[TCP Keep-Alive ACK] 80  >  33072 [ACK] Seq=780 Ack=436 Win=43648 Len=0 TSval=298753331 TSecr=90049"
"87","122.872116","10.8.8.110","216.58.208.46","TCP","52","[TCP Keep-Alive] 33072  >  80 [ACK] Seq=435 Ack=780 Win=30848 Len=0 TSval=95080 TSecr=298753331"
"88","122.994206","216.58.208.46","10.8.8.110","TCP","52","[TCP Keep-Alive ACK] 80  >  33072 [ACK] Seq=780 Ack=436 Win=43648 Len=0 TSval=298763454 TSecr=90049"
"89","130.411225","10.8.8.110","64.233.184.16","TCP","60","37388  >  465 [SYN] Seq=0 Win=29200 Len=0 MSS=1460 SACK_PERM TSval=96964 TSecr=0 WS=128"
"90","130.543821","64.233.184.16","10.8.8.110","TCP","60","465  >  37388 [SYN, ACK] Seq=0 Ack=1 Win=42540 Len=0 MSS=1320 SACK_PERM TSval=276587819 TSecr=96964 WS=128"
"91","130.543874","10.8.8.110","64.233.184.16","TCP","52","37388  >  465 [ACK] Seq=1 Ack=1 Win=29312 Len=0 TSval=96997 TSecr=276587819"
"92","130.544423","10.8.8.110","64.233.184.16","TLSv1.2","569","Client Hello (SNI=smtp.googlemail.com)"
"93","130.675152","64.233.184.16","10.8.8.110","TCP","52","465  >  37388 [ACK] Seq=1 Ack=518 Win=43648 Len=0 TSval=276587952 TSecr=96998"
"94","130.675797","64.233.184.16","10.8.8.110","TLSv1.2","189","Server Hello, Change Cipher Spec, Encrypted Handshake Message"
"95","130.675821","10.8.8.110","64.233.184.16","TCP","52","37388  >  465 [ACK] Seq=518 Ack=138 Win=30336 Len=0 TSval=97030 TSecr=276587953"
"96","130.676691","10.8.8.110","64.233.184.16","TLSv1.2","103","Change Cipher Spec, Encrypted Handshake Message"
"97","130.847360","64.233.184.16","10.8.8.110","TCP","52","465  >  37388 [ACK] Seq=138 Ack=569 Win=43648 Len=0 TSval=276588123 TSecr=97031"
"98","130.879348","64.233.184.16","10.8.8.110","TLSv1.2","132","Application Data"
"99","130.879709","10.8.8.110","64.233.184.16","TLSv1.2","100","Application Data"
"100","131.014607","64.233.184.16","10.8.8.110","TCP","52","465  >  37388 [ACK] Seq=218 Ack=617 Win=43648 Len=0 TSval=276588286 TSecr=97081"
"101","131.015921","64.233.184.16","10.8.8.110","TLSv1.2","290","Application Data"
"102","131.046356","10.8.8.110","64.233.184.16","TLSv1.2","134","Application Data"
"103","131.216959","64.233.184.16","10.8.8.110","TCP","52","465  >  37388 [ACK] Seq=456 Ack=699 Win=43648 Len=0 TSval=276588493 TSecr=97123"
"104","131.307754","64.233.184.16","10.8.8.110","TLSv1.2","101","Application Data"
"105","131.313519","10.8.8.110","64.233.184.16","TLSv1.2","123","Application Data"
"106","131.443358","64.233.184.16","10.8.8.110","TCP","52","465  >  37388 [ACK] Seq=505 Ack=770 Win=43648 Len=0 TSval=276588720 TSecr=97190"
"107","131.452195","64.233.184.16","10.8.8.110","TLSv1.2","121","Application Data"
"108","131.466849","10.8.8.110","64.233.184.16","TLSv1.2","112","Application Data"
"109","131.598133","64.233.184.16","10.8.8.110","TLSv1.2","121","Application Data"
"110","131.603763","10.8.8.110","64.233.184.16","TLSv1.2","87","Application Data"
"111","131.774316","64.233.184.16","10.8.8.110","TCP","52","465  >  37388 [ACK] Seq=643 Ack=865 Win=43648 Len=0 TSval=276589051 TSecr=97262"
"112","131.859571","64.233.184.16","10.8.8.110","TLSv1.2","122","Application Data"
"113","131.871388","10.8.8.110","64.233.184.16","TLSv1.2","448","Application Data"
"114","131.871823","10.8.8.110","64.233.184.16","TLSv1.2","84","Application Data"
"115","132.001581","64.233.184.16","10.8.8.110","TCP","52","465  >  37388 [ACK] Seq=713 Ack=1261 Win=44800 Len=0 TSval=276589278 TSecr=97329"
"116","132.001620","64.233.184.16","10.8.8.110","TCP","52","465  >  37388 [ACK] Seq=713 Ack=1293 Win=44800 Len=0 TSval=276589278 TSecr=97329"
"117","132.630251","64.233.184.16","10.8.8.110","TLSv1.2","132","Application Data"
"118","132.631038","10.8.8.110","64.233.184.16","TLSv1.2","87","Application Data"
"119","132.760935","64.233.184.16","10.8.8.110","TCP","52","465  >  37388 [ACK] Seq=793 Ack=1328 Win=44800 Len=0 TSval=276590038 TSecr=97519"
"120","132.766338","64.233.184.16","10.8.8.110","TLSv1.2","137","Application Data"
"121","132.769264","64.233.184.16","10.8.8.110","TCP","52","465  >  37388 [FIN, ACK] Seq=878 Ack=1328 Win=44800 Len=0 TSval=276590045 TSecr=97519"
"122","132.804078","10.8.8.110","64.233.184.16","TCP","52","37388  >  465 [ACK] Seq=1328 Ack=879 Win=31360 Len=0 TSval=97563 TSecr=276590043"
"123","132.821191","10.8.8.110","64.233.184.16","TLSv1.2","83","Encrypted Alert"
"124","132.821220","10.8.8.110","64.233.184.16","TCP","52","37388  >  465 [FIN, ACK] Seq=1359 Ack=879 Win=31360 Len=0 TSval=97567 TSecr=276590043"
"125","132.952167","64.233.184.16","10.8.8.110","TCP","40","465  >  37388 [RST] Seq=879 Win=0 Len=0"
"126","132.952240","64.233.184.16","10.8.8.110","TCP","40","465  >  37388 [RST] Seq=879 Win=0 Len=0"
"127","133.018079","10.8.8.110","216.58.208.46","TCP","52","[TCP Keep-Alive] 33072  >  80 [ACK] Seq=435 Ack=780 Win=30848 Len=0 TSval=97616 TSecr=298763454"
"128","133.139500","216.58.208.46","10.8.8.110","TCP","52","[TCP Keep-Alive ACK] 80  >  33072 [ACK] Seq=780 Ack=436 Win=43648 Len=0 TSval=298773598 TSecr=90049"
"129","143.161098","10.8.8.110","216.58.208.46","TCP","52","[TCP Keep-Alive] 33072  >  80 [ACK] Seq=435 Ack=780 Win=30848 Len=0 TSval=100152 TSecr=298773598"
"130","143.283296","216.58.208.46","10.8.8.110","TCP","52","[TCP Keep-Alive ACK] 80  >  33072 [ACK] Seq=780 Ack=436 Win=43648 Len=0 TSval=298783742 TSecr=90049"
"131","153.305241","10.8.8.110","216.58.208.46","TCP","52","[TCP Keep-Alive] 33072  >  80 [ACK] Seq=435 Ack=780 Win=30848 Len=0 TSval=102688 TSecr=298783742"
"132","153.426284","216.58.208.46","10.8.8.110","TCP","52","[TCP Keep-Alive ACK] 80  >  33072 [ACK] Seq=780 Ack=436 Win=43648 Len=0 TSval=298793884 TSecr=90049"
"133","163.448624","10.8.8.110","216.58.208.46","TCP","52","[TCP Keep-Alive] 33072  >  80 [ACK] Seq=435 Ack=780 Win=30848 Len=0 TSval=105224 TSecr=298793884"
"134","163.572275","216.58.208.46","10.8.8.110","TCP","52","[TCP Keep-Alive ACK] 80  >  33072 [ACK] Seq=780 Ack=436 Win=43648 Len=0 TSval=298804027 TSecr=90049"
"135","164.527878","10.8.8.110","64.233.184.16","TCP","60","37389  >  465 [SYN] Seq=0 Win=29200 Len=0 MSS=1460 SACK_PERM TSval=105493 TSecr=0 WS=128"
"136","164.529741","10.8.8.110","198.7.63.141","DNS","65","Standard query 0x0671 A smtp.googlemail.com"
"137","164.529773","10.8.8.110","78.46.223.24","DNS","65","Standard query 0x0671 A smtp.googlemail.com"
"138","164.530613","10.8.8.110","198.7.63.141","DNS","65","Standard query 0x7a36 AAAA smtp.googlemail.com"
"139","164.653192","198.7.63.141","10.8.8.110","DNS","256","Standard query response 0x0671 A smtp.googlemail.com CNAME googlemail-smtp.l.google.com A 64.233.184.16 NS ns4.google.com NS ns3.google.com NS ns1.google.com NS ns2.google.com A 216.239.32.10 A 216.239.34.10 A 216.239.36.10 A 216.239.38.10"
"140","164.654855","78.46.223.24","10.8.8.110","DNS","256","Standard query response 0x0671 A smtp.googlemail.com CNAME googlemail-smtp.l.google.com A 64.233.184.16 NS ns3.google.com NS ns4.google.com NS ns2.google.com NS ns1.google.com A 216.239.32.10 A 216.239.34.10 A 216.239.36.10 A 216.239.38.10"
"141","164.654903","10.8.8.110","78.46.223.24","ICMP","284","Destination unreachable (Port unreachable)"
"142","164.654925","198.7.63.141","10.8.8.110","DNS","268","Standard query response 0x7a36 AAAA smtp.googlemail.com CNAME googlemail-smtp.l.google.com AAAA 2a00:1450:400c:c0b::10 NS ns2.google.com NS ns4.google.com NS ns1.google.com NS ns3.google.com A 216.239.32.10 A 216.239.34.10 A 216.239.36.10 A 216.239.38.10"
"143","164.659693","64.233.184.16","10.8.8.110","TCP","60","465  >  37389 [SYN, ACK] Seq=0 Ack=1 Win=42540 Len=0 MSS=1320 SACK_PERM TSval=1625884604 TSecr=105493 WS=128"
"144","164.659775","10.8.8.110","64.233.184.16","TCP","52","37389  >  465 [ACK] Seq=1 Ack=1 Win=29312 Len=0 TSval=105526 TSecr=1625884604"
"145","164.660499","10.8.8.110","64.233.184.16","TLSv1.2","569","Client Hello (SNI=smtp.googlemail.com)"
"146","164.792011","64.233.184.16","10.8.8.110","TCP","52","465  >  37389 [ACK] Seq=1 Ack=518 Win=43648 Len=0 TSval=1625884734 TSecr=105527"
"147","164.792231","64.233.184.16","10.8.8.110","TLSv1.2","189","Server Hello, Change Cipher Spec, Encrypted Handshake Message"
"148","164.792245","10.8.8.110","64.233.184.16","TCP","52","37389  >  465 [ACK] Seq=518 Ack=138 Win=30336 Len=0 TSval=105560 TSecr=1625884735"
"149","164.792668","10.8.8.110","64.233.184.16","TLSv1.2","103","Change Cipher Spec, Encrypted Handshake Message"
"150","164.924758","64.233.184.16","10.8.8.110","TLSv1.2","132","Application Data"
"151","164.938169","10.8.8.110","64.233.184.16","TLSv1.2","100","Application Data"
"152","165.075712","64.233.184.16","10.8.8.110","TLSv1.2","290","Application Data"
"153","165.079315","10.8.8.110","64.233.184.16","TLSv1.2","134","Application Data"
"154","165.251749","64.233.184.16","10.8.8.110","TCP","52","465  >  37389 [ACK] Seq=456 Ack=699 Win=43648 Len=0 TSval=1625885193 TSecr=105631"
"155","165.348128","64.233.184.16","10.8.8.110","TLSv1.2","101","Application Data"
"156","165.353084","10.8.8.110","64.233.184.16","TLSv1.2","123","Application Data"
"157","165.483158","64.233.184.16","10.8.8.110","TCP","52","465  >  37389 [ACK] Seq=505 Ack=770 Win=43648 Len=0 TSval=1625885427 TSecr=105700"
"158","165.488930","64.233.184.16","10.8.8.110","TLSv1.2","121","Application Data"
"159","165.498729","10.8.8.110","64.233.184.16","TLSv1.2","112","Application Data"
"160","165.629239","64.233.184.16","10.8.8.110","TLSv1.2","121","Application Data"
"161","165.634624","10.8.8.110","64.233.184.16","TLSv1.2","87","Application Data"
"162","165.810147","64.233.184.16","10.8.8.110","TCP","52","465  >  37389 [ACK] Seq=643 Ack=865 Win=43648 Len=0 TSval=1625885748 TSecr=105770"
"163","165.889746","64.233.184.16","10.8.8.110","TLSv1.2","122","Application Data"
"164","165.902637","10.8.8.110","64.233.184.16","TLSv1.2","457","Application Data"
"165","165.903086","10.8.8.110","64.233.184.16","TLSv1.2","84","Application Data"
"166","166.033358","64.233.184.16","10.8.8.110","TCP","52","465  >  37389 [ACK] Seq=713 Ack=1270 Win=44800 Len=0 TSval=1625885976 TSecr=105837"
"167","166.035138","64.233.184.16","10.8.8.110","TCP","52","465  >  37389 [ACK] Seq=713 Ack=1302 Win=44800 Len=0 TSval=1625885976 TSecr=105837"
"168","166.620193","64.233.184.16","10.8.8.110","TLSv1.2","132","Application Data"
"169","166.620942","10.8.8.110","64.233.184.16","TLSv1.2","87","Application Data"
"170","166.752169","64.233.184.16","10.8.8.110","TCP","52","465  >  37389 [ACK] Seq=793 Ack=1337 Win=44800 Len=0 TSval=1625886695 TSecr=106017"
"171","166.754663","64.233.184.16","10.8.8.110","TLSv1.2","137","Application Data"
"172","166.754696","64.233.184.16","10.8.8.110","TCP","52","465  >  37389 [FIN, ACK] Seq=878 Ack=1337 Win=44800 Len=0 TSval=1625886696 TSecr=106017"
"173","166.789616","10.8.8.110","64.233.184.16","TLSv1.2","83","Encrypted Alert"
"174","166.789640","10.8.8.110","64.233.184.16","TCP","52","37389  >  465 [FIN, ACK] Seq=1368 Ack=879 Win=31360 Len=0 TSval=106059 TSecr=1625886696"
"175","166.920946","64.233.184.16","10.8.8.110","TCP","40","465  >  37389 [RST] Seq=879 Win=0 Len=0"
"176","166.921039","64.233.184.16","10.8.8.110","TCP","40","465  >  37389 [RST] Seq=879 Win=0 Len=0"
"177","173.592123","10.8.8.110","216.58.208.46","TCP","52","[TCP Keep-Alive] 33072  >  80 [ACK] Seq=435 Ack=780 Win=30848 Len=0 TSval=107760 TSecr=298804027"
"178","173.713920","216.58.208.46","10.8.8.110","TCP","52","[TCP Keep-Alive ACK] 80  >  33072 [ACK] Seq=780 Ack=436 Win=43648 Len=0 TSval=298814170 TSecr=90049"
"179","183.243903","10.8.8.110","198.7.63.141","DNS","73","Standard query 0x7141 A services.addons.mozilla.org"
"180","183.243962","10.8.8.110","198.7.63.141","DNS","73","Standard query 0xf2fe AAAA services.addons.mozilla.org"
"181","183.366871","198.7.63.141","10.8.8.110","DNS","274","Standard query response 0x7141 A services.addons.mozilla.org A 63.245.216.134 NS ns5-65.akam.net NS ns1-240.akam.net NS ns4-64.akam.net NS ns7-66.akam.net A 84.53.139.64 A 184.85.248.65 A 96.7.49.66 A 193.108.91.240 AAAA 2600:1401:2::f0"
"182","183.367254","198.7.63.141","10.8.8.110","DNS","122","Standard query response 0xf2fe AAAA services.addons.mozilla.org SOA ns.mozilla.org"
"183","183.367668","10.8.8.110","63.245.216.134","TCP","60","46949  >  443 [SYN] Seq=0 Win=29200 Len=0 MSS=1460 SACK_PERM TSval=110203 TSecr=0 WS=128"
"184","183.618245","10.8.8.110","63.245.216.134","TCP","60","46950  >  443 [SYN] Seq=0 Win=29200 Len=0 MSS=1460 SACK_PERM TSval=110266 TSecr=0 WS=128"
"185","183.618731","10.8.8.110","198.7.63.141","DNS","73","Standard query 0x4105 A services.addons.mozilla.org"
"186","183.635372","63.245.216.134","10.8.8.110","TCP","52","443  >  46949 [SYN, ACK] Seq=0 Ack=1 Win=8190 Len=0 MSS=1212 WS=16 SACK_PERM"
"187","183.635423","10.8.8.110","63.245.216.134","TCP","40","46949  >  443 [ACK] Seq=1 Ack=1 Win=29312 Len=0"
"188","183.635644","10.8.8.110","63.245.216.134","TLSv1.2","234","Client Hello (SNI=services.addons.mozilla.org)"
"189","183.736831","10.8.8.110","216.58.208.46","TCP","52","[TCP Keep-Alive] 33072  >  80 [ACK] Seq=435 Ack=780 Win=30848 Len=0 TSval=110296 TSecr=298814170"
"190","183.739764","198.7.63.141","10.8.8.110","DNS","274","Standard query response 0x4105 A services.addons.mozilla.org A 63.245.216.134 NS ns5-65.akam.net NS ns4-64.akam.net NS ns7-66.akam.net NS ns1-240.akam.net A 84.53.139.64 A 184.85.248.65 A 96.7.49.66 A 193.108.91.240 AAAA 2600:1401:2::f0"
"191","183.859696","216.58.208.46","10.8.8.110","TCP","52","[TCP Keep-Alive ACK] 80  >  33072 [ACK] Seq=780 Ack=436 Win=43648 Len=0 TSval=298824314 TSecr=90049"
"192","183.885502","63.245.216.134","10.8.8.110","TCP","52","443  >  46950 [SYN, ACK] Seq=0 Ack=1 Win=8190 Len=0 MSS=1212 WS=16 SACK_PERM"
"193","183.885556","10.8.8.110","63.245.216.134","TCP","40","46950  >  443 [ACK] Seq=1 Ack=1 Win=29312 Len=0"
"194","183.886197","10.8.8.110","63.245.216.134","TLSv1.2","234","Client Hello (SNI=services.addons.mozilla.org)"
"195","183.904131","63.245.216.134","10.8.8.110","TCP","1252","443  >  46949 [PSH, ACK] Seq=1 Ack=195 Win=35296 Len=1212 [TCP segment of a reassembled PDU]"
"196","183.904205","10.8.8.110","63.245.216.134","TCP","40","46949  >  443 [ACK] Seq=195 Ack=1213 Win=32128 Len=0"
"197","183.904265","63.245.216.134","10.8.8.110","TCP","1252","443  >  46949 [PSH, ACK] Seq=1213 Ack=195 Win=35296 Len=1212 [TCP segment of a reassembled PDU]"
"198","183.904275","10.8.8.110","63.245.216.134","TCP","40","46949  >  443 [ACK] Seq=195 Ack=2425 Win=35072 Len=0"
"199","183.904293","63.245.216.134","10.8.8.110","TLSv1.2","327","Server Hello, Certificate, Server Hello Done"
"200","183.904302","10.8.8.110","63.245.216.134","TCP","40","46949  >  443 [ACK] Seq=195 Ack=2712 Win=37504 Len=0"
"201","183.905761","10.8.8.110","63.245.216.134","TLSv1.2","382","Client Key Exchange, Change Cipher Spec, Encrypted Handshake Message"
"202","183.907698","10.8.8.110","198.7.63.141","DNS","63","Standard query 0x5bba A ocsp.digicert.com"
"203","183.907726","10.8.8.110","198.7.63.141","DNS","63","Standard query 0xbd22 AAAA ocsp.digicert.com"
"204","183.907873","10.8.8.110","198.7.63.141","DNS","63","Standard query 0x39ae A ocsp.digicert.com"
"205","184.029367","198.7.63.141","10.8.8.110","DNS","160","Standard query response 0xbd22 AAAA ocsp.digicert.com CNAME cs9.wac.phicdn.net SOA ns1.edgecastcdn.net"
"206","184.029443","198.7.63.141","10.8.8.110","DNS","235","Standard query response 0x5bba A ocsp.digicert.com CNAME cs9.wac.phicdn.net A 93.184.220.29 NS ns1.phicdn.net NS ns2.phicdn.net A 72.21.80.5 AAAA 2606:2800:1::5 A 72.21.80.6 AAAA 2606:2800:1::6"
"207","184.030019","198.7.63.141","10.8.8.110","DNS","235","Standard query response 0x39ae A ocsp.digicert.com CNAME cs9.wac.phicdn.net A 93.184.220.29 NS ns1.phicdn.net NS ns2.phicdn.net A 72.21.80.5 AAAA 2606:2800:1::5 A 72.21.80.6 AAAA 2606:2800:1::6"
"208","184.030242","10.8.8.110","93.184.220.29","TCP","60","39913  >  80 [SYN] Seq=0 Win=29200 Len=0 MSS=1460 SACK_PERM TSval=110369 TSecr=0 WS=128"
"209","184.150816","93.184.220.29","10.8.8.110","TCP","60","80  >  39913 [SYN, ACK] Seq=0 Ack=1 Win=14480 Len=0 MSS=1320 SACK_PERM TSval=1038536787 TSecr=110369 WS=512"
"210","184.150870","10.8.8.110","93.184.220.29","TCP","52","39913  >  80 [ACK] Seq=1 Ack=1 Win=29312 Len=0 TSval=110399 TSecr=1038536787"
"211","184.151125","10.8.8.110","93.184.220.29","OCSP","489","Request"
"212","184.152399","63.245.216.134","10.8.8.110","TCP","1252","443  >  46950 [PSH, ACK] Seq=1 Ack=195 Win=35296 Len=1212 [TCP segment of a reassembled PDU]"
"213","184.152443","10.8.8.110","63.245.216.134","TCP","40","46950  >  443 [ACK] Seq=195 Ack=1213 Win=32128 Len=0"
"214","184.152471","63.245.216.134","10.8.8.110","TCP","1252","443  >  46950 [PSH, ACK] Seq=1213 Ack=195 Win=35296 Len=1212 [TCP segment of a reassembled PDU]"
"215","184.152482","10.8.8.110","63.245.216.134","TCP","40","46950  >  443 [ACK] Seq=195 Ack=2425 Win=35072 Len=0"
"216","184.152499","63.245.216.134","10.8.8.110","TLSv1.2","327","Server Hello, Certificate, Server Hello Done"
"217","184.152508","10.8.8.110","63.245.216.134","TCP","40","46950  >  443 [ACK] Seq=195 Ack=2712 Win=37504 Len=0"
"218","184.153200","10.8.8.110","63.245.216.134","TLSv1.2","382","Client Key Exchange, Change Cipher Spec, Encrypted Handshake Message"
"219","184.154032","10.8.8.110","93.184.220.29","TCP","60","39914  >  80 [SYN] Seq=0 Win=29200 Len=0 MSS=1460 SACK_PERM TSval=110400 TSecr=0 WS=128"
"220","184.173360","63.245.216.134","10.8.8.110","TCP","40","443  >  46949 [ACK] Seq=2712 Ack=537 Win=34944 Len=0"
"221","184.176387","63.245.216.134","10.8.8.110","TLSv1.2","115","Change Cipher Spec, Encrypted Handshake Message"
"222","184.216065","10.8.8.110","63.245.216.134","TCP","40","46949  >  443 [ACK] Seq=537 Ack=2787 Win=37504 Len=0"
"223","184.273625","93.184.220.29","10.8.8.110","TCP","52","80  >  39913 [ACK] Seq=1 Ack=438 Win=15872 Len=0 TSval=1038536818 TSecr=110399"
"224","184.275030","93.184.220.29","10.8.8.110","OCSP","840","Response"
"225","184.275049","10.8.8.110","93.184.220.29","TCP","52","39913  >  80 [ACK] Seq=438 Ack=789 Win=30848 Len=0 TSval=110430 TSecr=1038536818"
"226","184.275330","10.8.8.110","93.184.220.29","OCSP","489","Request"
"227","184.276012","10.8.8.110","63.245.216.134","TLSv1.2","637","Application Data"
"228","184.282232","93.184.220.29","10.8.8.110","TCP","60","80  >  39914 [SYN, ACK] Seq=0 Ack=1 Win=14480 Len=0 MSS=1320 SACK_PERM TSval=1694274515 TSecr=110400 WS=512"
"229","184.282275","10.8.8.110","93.184.220.29","TCP","52","39914  >  80 [ACK] Seq=1 Ack=1 Win=29312 Len=0 TSval=110432 TSecr=1694274515"
"230","184.418035","93.184.220.29","10.8.8.110","OCSP","840","Response"
"231","184.420319","63.245.216.134","10.8.8.110","TCP","40","443  >  46950 [ACK] Seq=2712 Ack=537 Win=34944 Len=0"
"232","184.424255","63.245.216.134","10.8.8.110","TLSv1.2","115","Change Cipher Spec, Encrypted Handshake Message"
"233","184.456101","10.8.8.110","93.184.220.29","TCP","52","39913  >  80 [ACK] Seq=875 Ack=1577 Win=32384 Len=0 TSval=110476 TSecr=1038536854"
"234","184.464081","10.8.8.110","63.245.216.134","TCP","40","46950  >  443 [ACK] Seq=537 Ack=2787 Win=37504 Len=0"
"235","184.561556","63.245.216.134","10.8.8.110","TCP","40","443  >  46949 [ACK] Seq=2787 Ack=1134 Win=34352 Len=0"
"236","184.579719","63.245.216.134","10.8.8.110","TLSv1.2","509","Application Data"
"237","184.579756","10.8.8.110","63.245.216.134","TCP","40","46949  >  443 [ACK] Seq=1134 Ack=3256 Win=39936 Len=0"
"238","184.579778","63.245.216.134","10.8.8.110","TLSv1.2","109","Application Data"
"239","184.579788","10.8.8.110","63.245.216.134","TCP","40","46949  >  443 [ACK] Seq=1134 Ack=3325 Win=39936 Len=0"
"240","184.580976","10.8.8.110","63.245.216.134","TLSv1.2","93","Encrypted Alert"
"241","184.581718","10.8.8.110","63.245.216.134","TCP","40","46949  >  443 [FIN, ACK] Seq=1187 Ack=3325 Win=39936 Len=0"
"242","184.618496","10.8.8.110","198.7.63.141","DNS","77","Standard query 0xf267 A versioncheck.addons.mozilla.org"
"243","184.618776","10.8.8.110","198.7.63.141","DNS","77","Standard query 0x488e AAAA versioncheck.addons.mozilla.org"
"244","184.741270","198.7.63.141","10.8.8.110","DNS","310","Standard query response 0xf267 A versioncheck.addons.mozilla.org A 63.245.217.162 A 63.245.217.160 A 63.245.217.161 NS ns4-64.akam.net NS ns7-66.akam.net NS ns1-240.akam.net NS ns5-65.akam.net A 84.53.139.64 A 184.85.248.65 A 96.7.49.66 A 193.108.91.240 AAAA 2600:1401:2::f0"
"245","184.741413","198.7.63.141","10.8.8.110","DNS","126","Standard query response 0x488e AAAA versioncheck.addons.mozilla.org SOA ns.mozilla.org"
"246","184.741865","10.8.8.110","63.245.217.162","TCP","60","45061  >  443 [SYN] Seq=0 Win=29200 Len=0 MSS=1460 SACK_PERM TSval=110547 TSecr=0 WS=128"
"247","184.849555","63.245.216.134","10.8.8.110","TCP","40","443  >  46949 [ACK] Seq=3325 Ack=1187 Win=40896 Len=0"
"248","184.849600","63.245.216.134","10.8.8.110","TCP","40","443  >  46949 [FIN, ACK] Seq=3325 Ack=1188 Win=40896 Len=0"
"249","184.849623","10.8.8.110","63.245.216.134","TCP","40","46949  >  443 [ACK] Seq=1188 Ack=3326 Win=39936 Len=0"
"250","184.993258","10.8.8.110","63.245.217.162","TCP","60","45062  >  443 [SYN] Seq=0 Win=29200 Len=0 MSS=1460 SACK_PERM TSval=110610 TSecr=0 WS=128"
"251","184.993498","10.8.8.110","198.7.63.141","DNS","77","Standard query 0xb47f A versioncheck.addons.mozilla.org"
"252","184.993513","10.8.8.110","78.46.223.24","DNS","77","Standard query 0xb47f A versioncheck.addons.mozilla.org"
"253","185.006311","63.245.217.162","10.8.8.110","TCP","60","443  >  45061 [SYN, ACK] Seq=0 Ack=1 Win=14480 Len=0 MSS=1320 SACK_PERM TSval=1920163192 TSecr=110547 WS=1024"
"254","185.006390","10.8.8.110","63.245.217.162","TCP","52","45061  >  443 [ACK] Seq=1 Ack=1 Win=29312 Len=0 TSval=110613 TSecr=1920163192"
"255","185.006628","10.8.8.110","63.245.217.162","TLSv1.2","250","Client Hello (SNI=versioncheck.addons.mozilla.org)"
"256","185.114937","198.7.63.141","10.8.8.110","DNS","310","Standard query response 0xb47f A versioncheck.addons.mozilla.org A 63.245.217.160 A 63.245.217.161 A 63.245.217.162 NS ns1-240.akam.net NS ns5-65.akam.net NS ns7-66.akam.net NS ns4-64.akam.net A 84.53.139.64 A 184.85.248.65 A 96.7.49.66 A 193.108.91.240 AAAA 2600:1401:2::f0"
"257","185.115107","78.46.223.24","10.8.8.110","DNS","310","Standard query response 0xb47f A versioncheck.addons.mozilla.org A 63.245.217.161 A 63.245.217.162 A 63.245.217.160 NS ns7-66.akam.net NS ns1-240.akam.net NS ns5-65.akam.net NS ns4-64.akam.net A 84.53.139.64 A 184.85.248.65 A 96.7.49.66 A 193.108.91.240 AAAA 2600:1401:2::f0"
"258","185.261663","63.245.217.162","10.8.8.110","TCP","60","443  >  45062 [SYN, ACK] Seq=0 Ack=1 Win=14480 Len=0 MSS=1320 SACK_PERM TSval=1920163443 TSecr=110610 WS=1024"
"259","185.261733","10.8.8.110","63.245.217.162","TCP","52","45062  >  443 [ACK] Seq=1 Ack=1 Win=29312 Len=0 TSval=110677 TSecr=1920163443"
"260","185.261996","10.8.8.110","63.245.217.162","TLSv1.2","250","Client Hello (SNI=versioncheck.addons.mozilla.org)"
"261","185.270396","63.245.217.162","10.8.8.110","TCP","52","443  >  45061 [ACK] Seq=1 Ack=199 Win=16384 Len=0 TSval=1920163456 TSecr=110613"
"262","185.271166","63.245.217.162","10.8.8.110","TLSv1.2","1360","Server Hello"
"263","185.271186","10.8.8.110","63.245.217.162","TCP","52","45061  >  443 [ACK] Seq=199 Ack=1309 Win=32128 Len=0 TSval=110679 TSecr=1920163456"
"264","185.271275","63.245.217.162","10.8.8.110","TCP","1360","443  >  45061 [ACK] Seq=1309 Ack=199 Win=16384 Len=1308 TSval=1920163456 TSecr=110613 [TCP segment of a reassembled PDU]"
"265","185.271291","10.8.8.110","63.245.217.162","TCP","52","45061  >  443 [ACK] Seq=199 Ack=2617 Win=35072 Len=0 TSval=110679 TSecr=1920163456"
"266","185.271318","63.245.217.162","10.8.8.110","TLSv1.2","161","Certificate, Server Hello Done"
"267","185.271332","10.8.8.110","63.245.217.162","TCP","52","45061  >  443 [ACK] Seq=199 Ack=2726 Win=35072 Len=0 TSval=110679 TSecr=1920163456"
"268","185.272199","10.8.8.110","63.245.217.162","TLSv1.2","394","Client Key Exchange, Change Cipher Spec, Encrypted Handshake Message"
"269","185.529065","63.245.217.162","10.8.8.110","TCP","52","443  >  45062 [ACK] Seq=1 Ack=199 Win=16384 Len=0 TSval=1920163712 TSecr=110677"
"270","185.529112","63.245.217.162","10.8.8.110","TLSv1.2","1360","Server Hello"
"271","185.529128","10.8.8.110","63.245.217.162","TCP","52","45062  >  443 [ACK] Seq=199 Ack=1309 Win=32128 Len=0 TSval=110744 TSecr=1920163712"
"272","185.529177","63.245.217.162","10.8.8.110","TCP","1360","443  >  45062 [ACK] Seq=1309 Ack=199 Win=16384 Len=1308 TSval=1920163712 TSecr=110677 [TCP segment of a reassembled PDU]"
"273","185.529188","10.8.8.110","63.245.217.162","TCP","52","45062  >  443 [ACK] Seq=199 Ack=2617 Win=35072 Len=0 TSval=110744 TSecr=1920163712"
"274","185.529206","63.245.217.162","10.8.8.110","TLSv1.2","161","Certificate, Server Hello Done"
"275","185.529215","10.8.8.110","63.245.217.162","TCP","52","45062  >  443 [ACK] Seq=199 Ack=2726 Win=35072 Len=0 TSval=110744 TSecr=1920163712"
"276","185.530049","10.8.8.110","63.245.217.162","TLSv1.2","394","Client Key Exchange, Change Cipher Spec, Encrypted Handshake Message"
"277","185.577257","63.245.217.162","10.8.8.110","TCP","52","443  >  45061 [ACK] Seq=2726 Ack=541 Win=17408 Len=0 TSval=1920163763 TSecr=110680"
"278","185.598138","63.245.217.162","10.8.8.110","TLSv1.2","127","Change Cipher Spec, Encrypted Handshake Message"
"279","185.598665","10.8.8.110","63.245.217.162","TLSv1.2","745","Application Data"
"280","185.836709","63.245.217.162","10.8.8.110","TCP","52","443  >  45062 [ACK] Seq=2726 Ack=541 Win=17408 Len=0 TSval=1920164020 TSecr=110744"
"281","185.863461","63.245.217.162","10.8.8.110","TCP","52","443  >  45061 [ACK] Seq=2801 Ack=1234 Win=18432 Len=0 TSval=1920164049 TSecr=110761"
"282","185.885891","63.245.217.162","10.8.8.110","TLSv1.2","585","Application Data"
"283","185.886244","10.8.8.110","63.245.217.162","TLSv1.2","729","Application Data"
"284","185.936164","63.245.217.162","10.8.8.110","TLSv1.2","127","Change Cipher Spec, Encrypted Handshake Message"
"285","185.937443","10.8.8.110","63.245.217.162","TLSv1.2","745","Application Data"
"286","186.179383","63.245.217.162","10.8.8.110","TLSv1.2","585","Application Data"
"287","186.205843","63.245.217.162","10.8.8.110","TCP","52","443  >  45062 [ACK] Seq=2801 Ack=1234 Win=18432 Len=0 TSval=1920164388 TSecr=110846"
"288","186.214568","63.245.217.162","10.8.8.110","TLSv1.2","585","Application Data"
"289","186.219138","10.8.8.110","63.245.217.162","TCP","52","45061  >  443 [ACK] Seq=1911 Ack=3867 Win=38784 Len=0 TSval=110916 TSecr=1920164365"
"290","186.252168","10.8.8.110","63.245.217.162","TCP","52","45062  >  443 [ACK] Seq=1234 Ack=3334 Win=37632 Len=0 TSval=110925 TSecr=1920164397"
"291","189.639897","10.8.8.110","63.245.216.134","TLSv1.2","93","Encrypted Alert"
"292","189.639935","10.8.8.110","63.245.216.134","TCP","40","46950  >  443 [FIN, ACK] Seq=590 Ack=2787 Win=37504 Len=0"
"293","189.640061","10.8.8.110","93.184.220.29","TCP","52","39914  >  80 [FIN, ACK] Seq=1 Ack=1 Win=29312 Len=0 TSval=111772 TSecr=1694274515"
"294","189.767106","93.184.220.29","10.8.8.110","TCP","52","80  >  39914 [FIN, ACK] Seq=1 Ack=2 Win=14848 Len=0 TSval=1694275886 TSecr=111772"
"295","189.767152","10.8.8.110","93.184.220.29","TCP","52","39914  >  80 [ACK] Seq=2 Ack=2 Win=29312 Len=0 TSval=111803 TSecr=1694275886"
"296","189.905896","63.245.216.134","10.8.8.110","TCP","40","443  >  46950 [ACK] Seq=2787 Ack=590 Win=34896 Len=0"
"297","189.905951","63.245.216.134","10.8.8.110","TCP","40","443  >  46950 [FIN, ACK] Seq=2787 Ack=591 Win=34896 Len=0"
"298","189.905970","10.8.8.110","63.245.216.134","TCP","40","46950  >  443 [ACK] Seq=591 Ack=2788 Win=37504 Len=0"
"299","193.881047","10.8.8.110","216.58.208.46","TCP","52","[TCP Keep-Alive] 33072  >  80 [ACK] Seq=435 Ack=780 Win=30848 Len=0 TSval=112832 TSecr=298824314"
"300","194.003587","216.58.208.46","10.8.8.110","TCP","52","[TCP Keep-Alive ACK] 80  >  33072 [ACK] Seq=780 Ack=436 Win=43648 Len=0 TSval=298834457 TSecr=90049"
"301","194.417004","10.8.8.110","93.184.220.29","TCP","52","[TCP Keep-Alive] 39913  >  80 [ACK] Seq=874 Ack=1577 Win=32384 Len=0 TSval=112966 TSecr=1038536854"
"302","194.541254","93.184.220.29","10.8.8.110","TCP","52","[TCP Keep-Alive ACK] 80  >  39913 [ACK] Seq=1577 Ack=875 Win=16896 Len=0 TSval=1038539384 TSecr=110476"
"303","195.220081","10.8.8.110","64.233.184.16","TCP","60","37396  >  465 [SYN] Seq=0 Win=29200 Len=0 MSS=1460 SACK_PERM TSval=113167 TSecr=0 WS=128"
"304","195.365697","64.233.184.16","10.8.8.110","TCP","60","465  >  37396 [SYN, ACK] Seq=0 Ack=1 Win=42540 Len=0 MSS=1320 SACK_PERM TSval=1735350247 TSecr=113167 WS=128"
"305","195.365782","10.8.8.110","64.233.184.16","TCP","52","37396  >  465 [ACK] Seq=1 Ack=1 Win=29312 Len=0 TSval=113203 TSecr=1735350247"
"306","195.366552","10.8.8.110","64.233.184.16","TLSv1.2","569","Client Hello (SNI=smtp.googlemail.com)"
"307","195.498203","64.233.184.16","10.8.8.110","TCP","52","465  >  37396 [ACK] Seq=1 Ack=518 Win=43648 Len=0 TSval=1735350392 TSecr=113203"
"308","195.498437","64.233.184.16","10.8.8.110","TLSv1.2","189","Server Hello, Change Cipher Spec, Encrypted Handshake Message"
"309","195.498462","10.8.8.110","64.233.184.16","TCP","52","37396  >  465 [ACK] Seq=518 Ack=138 Win=30336 Len=0 TSval=113236 TSecr=1735350393"
"310","195.499051","10.8.8.110","64.233.184.16","TLSv1.2","103","Change Cipher Spec, Encrypted Handshake Message"
"311","195.663962","64.233.184.16","10.8.8.110","TLSv1.2","133","Application Data"
"312","195.700073","10.8.8.110","64.233.184.16","TCP","52","37396  >  465 [ACK] Seq=569 Ack=219 Win=30336 Len=0 TSval=113287 TSecr=1735350560"
"313","195.701490","10.8.8.110","64.233.184.16","TLSv1.2","100","Application Data"
"314","195.842585","64.233.184.16","10.8.8.110","TLSv1.2","290","Application Data"
"315","195.842613","10.8.8.110","64.233.184.16","TCP","52","37396  >  465 [ACK] Seq=617 Ack=457 Win=31360 Len=0 TSval=113322 TSecr=1735350736"
"316","195.846079","10.8.8.110","64.233.184.16","TLSv1.2","134","Application Data"
"317","196.018037","64.233.184.16","10.8.8.110","TCP","52","465  >  37396 [ACK] Seq=457 Ack=699 Win=43648 Len=0 TSval=1735350912 TSecr=113323"
"318","196.107902","64.233.184.16","10.8.8.110","TLSv1.2","101","Application Data"
"319","196.122606","10.8.8.110","64.233.184.16","TLSv1.2","123","Application Data"
"320","196.184084","10.8.8.110","63.245.217.162","TCP","52","[TCP Keep-Alive] 45061  >  443 [ACK] Seq=1910 Ack=3867 Win=38784 Len=0 TSval=113408 TSecr=1920164365"
"321","196.212114","10.8.8.110","63.245.217.162","TCP","52","[TCP Keep-Alive] 45062  >  443 [ACK] Seq=1233 Ack=3334 Win=37632 Len=0 TSval=113415 TSecr=1920164397"
"322","196.251866","64.233.184.16","10.8.8.110","TCP","52","465  >  37396 [ACK] Seq=506 Ack=770 Win=43648 Len=0 TSval=1735351148 TSecr=113392"
"323","196.252741","64.233.184.16","10.8.8.110","TLSv1.2","122","Application Data"
"324","196.255076","10.8.8.110","64.233.184.16","TLSv1.2","112","Application Data"
"325","196.385609","64.233.184.16","10.8.8.110","TLSv1.2","122","Application Data"
"326","196.386272","10.8.8.110","64.233.184.16","TLSv1.2","87","Application Data"
"327","196.448267","63.245.217.162","10.8.8.110","TCP","52","[TCP Keep-Alive ACK] 443  >  45061 [ACK] Seq=3867 Ack=1911 Win=19456 Len=0 TSval=1920174633 TSecr=110916"
"328","196.481818","63.245.217.162","10.8.8.110","TCP","52","[TCP Keep-Alive ACK] 443  >  45062 [ACK] Seq=3334 Ack=1234 Win=18432 Len=0 TSval=1920174664 TSecr=110925"
"329","196.557513","64.233.184.16","10.8.8.110","TCP","52","465  >  37396 [ACK] Seq=646 Ack=865 Win=43648 Len=0 TSval=1735351453 TSecr=113458"
"330","196.647185","64.233.184.16","10.8.8.110","TLSv1.2","123","Application Data"
"331","196.648957","10.8.8.110","64.233.184.16","TLSv1.2","457","Application Data"
"332","196.778914","64.233.184.16","10.8.8.110","TCP","52","465  >  37396 [ACK] Seq=717 Ack=1270 Win=44800 Len=0 TSval=1735351675 TSecr=113524"
"333","197.339835","64.233.184.16","10.8.8.110","TLSv1.2","133","Application Data"
"334","197.341933","10.8.8.110","64.233.184.16","TLSv1.2","87","Application Data"
"335","197.403843","63.245.217.162","10.8.8.110","TCP","52","443  >  45062 [FIN, ACK] Seq=3334 Ack=1234 Win=18432 Len=0 TSval=1920175586 TSecr=110925"
"336","197.404692","10.8.8.110","63.245.217.162","TLSv1.2","105","Encrypted Alert"
"337","197.404711","10.8.8.110","63.245.217.162","TCP","52","45062  >  443 [FIN, ACK] Seq=1287 Ack=3335 Win=37632 Len=0 TSval=113713 TSecr=1920175586"
"338","197.404767","63.245.217.162","10.8.8.110","TCP","52","443  >  45061 [FIN, ACK] Seq=3867 Ack=1911 Win=19456 Len=0 TSval=1920175590 TSecr=110916"
"339","197.405310","10.8.8.110","63.245.217.162","TLSv1.2","105","Encrypted Alert"
"340","197.405326","10.8.8.110","63.245.217.162","TCP","52","45061  >  443 [FIN, ACK] Seq=1964 Ack=3868 Win=38784 Len=0 TSval=113713 TSecr=1920175590"
"341","197.471301","64.233.184.16","10.8.8.110","TCP","52","465  >  37396 [ACK] Seq=798 Ack=1305 Win=44800 Len=0 TSval=1735352367 TSecr=113693"
"342","197.472761","64.233.184.16","10.8.8.110","TLSv1.2","138","Application Data"
"343","197.472815","64.233.184.16","10.8.8.110","TCP","52","465  >  37396 [FIN, ACK] Seq=884 Ack=1305 Win=44800 Len=0 TSval=1735352368 TSecr=113693"
"344","197.512090","10.8.8.110","64.233.184.16","TCP","52","37396  >  465 [ACK] Seq=1305 Ack=885 Win=31360 Len=0 TSval=113740 TSecr=1735352368"
"345","197.537362","10.8.8.110","64.233.184.16","TLSv1.2","83","Encrypted Alert"
"346","197.537389","10.8.8.110","64.233.184.16","TCP","52","37396  >  465 [FIN, ACK] Seq=1336 Ack=885 Win=31360 Len=0 TSval=113746 TSecr=1735352368"
"347","197.667717","64.233.184.16","10.8.8.110","TCP","40","465  >  37396 [RST] Seq=885 Win=0 Len=0"
"348","197.667783","64.233.184.16","10.8.8.110","TCP","40","465  >  37396 [RST] Seq=885 Win=0 Len=0"
"349","197.671544","63.245.217.162","10.8.8.110","TCP","40","443  >  45061 [RST] Seq=3868 Win=0 Len=0"
"350","197.671593","63.245.217.162","10.8.8.110","TCP","40","443  >  45061 [RST] Seq=3868 Win=0 Len=0"
"351","197.672012","63.245.217.162","10.8.8.110","TCP","40","443  >  45062 [RST] Seq=3335 Win=0 Len=0"
"352","197.676014","63.245.217.162","10.8.8.110","TCP","40","443  >  45062 [RST] Seq=3335 Win=0 Len=0"
"353","200.045824","93.184.220.29","10.8.8.110","TCP","52","80  >  39913 [FIN, ACK] Seq=1577 Ack=875 Win=16896 Len=0 TSval=1038540760 TSecr=110476"
"354","200.046016","10.8.8.110","93.184.220.29","TCP","52","39913  >  80 [FIN, ACK] Seq=875 Ack=1578 Win=32384 Len=0 TSval=114373 TSecr=1038540760"
"355","200.168185","93.184.220.29","10.8.8.110","TCP","52","80  >  39913 [ACK] Seq=1578 Ack=876 Win=16896 Len=0 TSval=1038540791 TSecr=114373"
"356","204.024580","10.8.8.110","216.58.208.46","TCP","52","[TCP Keep-Alive] 33072  >  80 [ACK] Seq=435 Ack=780 Win=30848 Len=0 TSval=115368 TSecr=298834457"
"357","204.146134","216.58.208.46","10.8.8.110","TCP","52","[TCP Keep-Alive ACK] 80  >  33072 [ACK] Seq=780 Ack=436 Win=43648 Len=0 TSval=298844600 TSecr=90049"
"358","214.168108","10.8.8.110","216.58.208.46","TCP","52","[TCP Keep-Alive] 33072  >  80 [ACK] Seq=435 Ack=780 Win=30848 Len=0 TSval=117904 TSecr=298844600"
"359","214.289867","216.58.208.46","10.8.8.110","TCP","52","[TCP Keep-Alive ACK] 80  >  33072 [ACK] Seq=780 Ack=436 Win=43648 Len=0 TSval=298854743 TSecr=90049"
"360","218.643905","10.8.8.110","216.58.208.46","TCP","52","33072  >  80 [FIN, ACK] Seq=436 Ack=780 Win=30848 Len=0 TSval=119022 TSecr=298854743"
"361","218.765684","216.58.208.46","10.8.8.110","TCP","52","80  >  33072 [FIN, ACK] Seq=780 Ack=437 Win=43648 Len=0 TSval=298859218 TSecr=119022"
"362","218.765728","10.8.8.110","216.58.208.46","TCP","52","33072  >  80 [ACK] Seq=437 Ack=781 Win=30848 Len=0 TSval=119053 TSecr=298859218"
"363","271.126428","10.8.8.110","64.233.184.16","TCP","60","37397  >  465 [SYN] Seq=0 Win=29200 Len=0 MSS=1460 SACK_PERM TSval=132143 TSecr=0 WS=128"
"364","271.128098","10.8.8.110","198.7.63.141","DNS","65","Standard query 0x732b A smtp.googlemail.com"
"365","271.128113","10.8.8.110","78.46.223.24","DNS","65","Standard query 0x732b A smtp.googlemail.com"
"366","271.130492","10.8.8.110","198.7.63.141","DNS","65","Standard query 0x1a92 AAAA smtp.googlemail.com"
"367","271.254631","198.7.63.141","10.8.8.110","DNS","256","Standard query response 0x732b A smtp.googlemail.com CNAME googlemail-smtp.l.google.com A 64.233.184.16 NS ns3.google.com NS ns2.google.com NS ns4.google.com NS ns1.google.com A 216.239.32.10 A 216.239.34.10 A 216.239.36.10 A 216.239.38.10"
"368","271.255291","78.46.223.24","10.8.8.110","DNS","256","Standard query response 0x732b A smtp.googlemail.com CNAME googlemail-smtp.l.google.com A 64.233.184.16 NS ns2.google.com NS ns1.google.com NS ns3.google.com NS ns4.google.com A 216.239.32.10 A 216.239.34.10 A 216.239.36.10 A 216.239.38.10"
"369","271.255315","10.8.8.110","78.46.223.24","ICMP","284","Destination unreachable (Port unreachable)"
"370","271.255335","198.7.63.141","10.8.8.110","DNS","268","Standard query response 0x1a92 AAAA smtp.googlemail.com CNAME googlemail-smtp.l.google.com AAAA 2a00:1450:400c:c0b::10 NS ns1.google.com NS ns4.google.com NS ns2.google.com NS ns3.google.com A 216.239.32.10 A 216.239.34.10 A 216.239.36.10 A 216.239.38.10"
"371","271.261395","64.233.184.16","10.8.8.110","TCP","60","465  >  37397 [SYN, ACK] Seq=0 Ack=1 Win=42540 Len=0 MSS=1320 SACK_PERM TSval=1474865861 TSecr=132143 WS=128"
"372","271.261467","10.8.8.110","64.233.184.16","TCP","52","37397  >  465 [ACK] Seq=1 Ack=1 Win=29312 Len=0 TSval=132177 TSecr=1474865861"
"373","271.262250","10.8.8.110","64.233.184.16","TLSv1.2","569","Client Hello (SNI=smtp.googlemail.com)"
"374","271.391408","64.233.184.16","10.8.8.110","TCP","52","465  >  37397 [ACK] Seq=1 Ack=518 Win=43648 Len=0 TSval=1474865994 TSecr=132177"
"375","271.392007","64.233.184.16","10.8.8.110","TLSv1.2","189","Server Hello, Change Cipher Spec, Encrypted Handshake Message"
"376","271.392104","10.8.8.110","64.233.184.16","TCP","52","37397  >  465 [ACK] Seq=518 Ack=138 Win=30336 Len=0 TSval=132209 TSecr=1474865994"
"377","271.392863","10.8.8.110","64.233.184.16","TLSv1.2","103","Change Cipher Spec, Encrypted Handshake Message"
"378","271.563684","64.233.184.16","10.8.8.110","TCP","52","465  >  37397 [ACK] Seq=138 Ack=569 Win=43648 Len=0 TSval=1474866164 TSecr=132210"
"379","271.568519","64.233.184.16","10.8.8.110","TLSv1.2","133","Application Data"
"380","271.572171","10.8.8.110","64.233.184.16","TLSv1.2","100","Application Data"
"381","271.707522","64.233.184.16","10.8.8.110","TCP","52","465  >  37397 [ACK] Seq=219 Ack=617 Win=43648 Len=0 TSval=1474866304 TSecr=132255"
"382","271.710063","64.233.184.16","10.8.8.110","TLSv1.2","290","Application Data"
"383","271.728211","10.8.8.110","64.233.184.16","TLSv1.2","134","Application Data"
"384","271.898908","64.233.184.16","10.8.8.110","TCP","52","465  >  37397 [ACK] Seq=457 Ack=699 Win=43648 Len=0 TSval=1474866501 TSecr=132294"
"385","272.026260","64.233.184.16","10.8.8.110","TLSv1.2","101","Application Data"
"386","272.043064","10.8.8.110","64.233.184.16","TLSv1.2","123","Application Data"
"387","272.172921","64.233.184.16","10.8.8.110","TCP","52","465  >  37397 [ACK] Seq=506 Ack=770 Win=43648 Len=0 TSval=1474866774 TSecr=132372"
"388","272.172953","64.233.184.16","10.8.8.110","TLSv1.2","122","Application Data"
"389","272.176776","10.8.8.110","64.233.184.16","TLSv1.2","112","Application Data"
"390","272.308299","64.233.184.16","10.8.8.110","TLSv1.2","122","Application Data"
"391","272.339374","10.8.8.110","64.233.184.16","TLSv1.2","87","Application Data"
"392","272.508872","64.233.184.16","10.8.8.110","TCP","52","465  >  37397 [ACK] Seq=646 Ack=865 Win=43648 Len=0 TSval=1474867111 TSecr=132446"
"393","272.641103","64.233.184.16","10.8.8.110","TLSv1.2","123","Application Data"
"394","272.655291","10.8.8.110","64.233.184.16","TLSv1.2","460","Application Data"
"395","272.785410","64.233.184.16","10.8.8.110","TCP","52","465  >  37397 [ACK] Seq=717 Ack=1273 Win=44800 Len=0 TSval=1474867387 TSecr=132525"
"396","273.370327","64.233.184.16","10.8.8.110","TLSv1.2","133","Application Data"
"397","273.376403","10.8.8.110","64.233.184.16","TLSv1.2","87","Application Data"
"398","273.506424","64.233.184.16","10.8.8.110","TCP","52","465  >  37397 [ACK] Seq=798 Ack=1308 Win=44800 Len=0 TSval=1474868108 TSecr=132706"
"399","273.506458","64.233.184.16","10.8.8.110","TLSv1.2","138","Application Data"
"400","273.508237","64.233.184.16","10.8.8.110","TCP","52","465  >  37397 [FIN, ACK] Seq=884 Ack=1308 Win=44800 Len=0 TSval=1474868108 TSecr=132706"
"401","273.544110","10.8.8.110","64.233.184.16","TCP","52","37397  >  465 [ACK] Seq=1308 Ack=885 Win=31360 Len=0 TSval=132748 TSecr=1474868108"
"402","273.561156","10.8.8.110","64.233.184.16","TLSv1.2","83","Encrypted Alert"
"403","273.561184","10.8.8.110","64.233.184.16","TCP","52","37397  >  465 [FIN, ACK] Seq=1339 Ack=885 Win=31360 Len=0 TSval=132752 TSecr=1474868108"
"404","273.691221","64.233.184.16","10.8.8.110","TCP","40","465  >  37397 [RST] Seq=885 Win=0 Len=0"
"405","273.691321","64.233.184.16","10.8.8.110","TCP","40","465  >  37397 [RST] Seq=885 Win=0 Len=0"
"406","302.977488","10.8.8.110","198.7.63.141","DNS","64","Standard query 0x712f A addons.mozilla.org"
"407","302.977520","10.8.8.110","78.46.223.24","DNS","64","Standard query 0x712f A addons.mozilla.org"
"408","302.977789","10.8.8.110","198.7.63.141","DNS","64","Standard query 0x11b6 AAAA addons.mozilla.org"
"409","303.108504","198.7.63.141","10.8.8.110","DNS","278","Standard query response 0x11b6 AAAA addons.mozilla.org CNAME addons.dynect.mozilla.net AAAA 2620:101:8020:5::2:132 NS ns2.p27.dynect.net NS ns3.p27.dynect.net NS ns1.p27.dynect.net NS ns4.p27.dynect.net A 208.78.70.27 A 204.13.250.27 A 208.78.71.27 A 204.13.251.27"
"410","303.108570","198.7.63.141","10.8.8.110","DNS","266","Standard query response 0x712f A addons.mozilla.org CNAME addons.dynect.mozilla.net A 63.245.216.132 NS ns3.p27.dynect.net NS ns4.p27.dynect.net NS ns1.p27.dynect.net NS ns2.p27.dynect.net A 208.78.70.27 A 204.13.250.27 A 208.78.71.27 A 204.13.251.27"
"411","303.108599","78.46.223.24","10.8.8.110","DNS","266","Standard query response 0x712f A addons.mozilla.org CNAME addons.dynect.mozilla.net A 63.245.216.132 NS ns4.p27.dynect.net NS ns1.p27.dynect.net NS ns3.p27.dynect.net NS ns2.p27.dynect.net A 208.78.70.27 A 204.13.250.27 A 208.78.71.27 A 204.13.251.27"
"412","303.109435","10.8.8.110","63.245.216.132","TCP","60","39035  >  443 [SYN] Seq=0 Win=29200 Len=0 MSS=1460 SACK_PERM TSval=140139 TSecr=0 WS=128"
"413","303.361946","10.8.8.110","63.245.216.132","TCP","60","39036  >  443 [SYN] Seq=0 Win=29200 Len=0 MSS=1460 SACK_PERM TSval=140202 TSecr=0 WS=128"
"414","303.362311","10.8.8.110","198.7.63.141","DNS","64","Standard query 0x0942 A addons.mozilla.org"
"415","303.374078","63.245.216.132","10.8.8.110","TCP","52","443  >  39035 [SYN, ACK] Seq=0 Ack=1 Win=8190 Len=0 MSS=1212 WS=16 SACK_PERM"
"416","303.374139","10.8.8.110","63.245.216.132","TCP","40","39035  >  443 [ACK] Seq=1 Ack=1 Win=29312 Len=0"
"417","303.374571","10.8.8.110","63.245.216.132","TLSv1.2","225","Client Hello (SNI=addons.mozilla.org)"
"418","303.483603","198.7.63.141","10.8.8.110","DNS","266","Standard query response 0x0942 A addons.mozilla.org CNAME addons.dynect.mozilla.net A 63.245.216.132 NS ns2.p27.dynect.net NS ns1.p27.dynect.net NS ns3.p27.dynect.net NS ns4.p27.dynect.net A 208.78.70.27 A 204.13.250.27 A 208.78.71.27 A 204.13.251.27"
"419","303.628482","63.245.216.132","10.8.8.110","TCP","52","443  >  39036 [SYN, ACK] Seq=0 Ack=1 Win=8190 Len=0 MSS=1212 WS=16 SACK_PERM"
"420","303.628557","10.8.8.110","63.245.216.132","TCP","40","39036  >  443 [ACK] Seq=1 Ack=1 Win=29312 Len=0"
"421","303.628970","10.8.8.110","63.245.216.132","TLSv1.2","225","Client Hello (SNI=addons.mozilla.org)"
"422","303.638106","63.245.216.132","10.8.8.110","TCP","1252","443  >  39035 [PSH, ACK] Seq=1 Ack=186 Win=35312 Len=1212 [TCP segment of a reassembled PDU]"
"423","303.638160","10.8.8.110","63.245.216.132","TCP","40","39035  >  443 [ACK] Seq=186 Ack=1213 Win=32128 Len=0"
"424","303.638201","63.245.216.132","10.8.8.110","TCP","1252","443  >  39035 [PSH, ACK] Seq=1213 Ack=186 Win=35312 Len=1212 [TCP segment of a reassembled PDU]"
"425","303.638217","10.8.8.110","63.245.216.132","TCP","40","39035  >  443 [ACK] Seq=186 Ack=2425 Win=35072 Len=0"
"426","303.638254","63.245.216.132","10.8.8.110","TCP","1252","443  >  39035 [PSH, ACK] Seq=2425 Ack=186 Win=35312 Len=1212 [TCP segment of a reassembled PDU]"
"427","303.638268","10.8.8.110","63.245.216.132","TCP","40","39035  >  443 [ACK] Seq=186 Ack=3637 Win=38016 Len=0"
"428","303.638322","63.245.216.132","10.8.8.110","TLSv1.2","140","Server Hello, Certificate, Server Hello Done"
"429","303.638336","10.8.8.110","63.245.216.132","TCP","40","39035  >  443 [ACK] Seq=186 Ack=3737 Win=38016 Len=0"
"430","303.640768","10.8.8.110","63.245.216.132","TLSv1.2","382","Client Key Exchange, Change Cipher Spec, Encrypted Handshake Message"
"431","303.642142","10.8.8.110","93.184.220.29","TCP","60","39921  >  80 [SYN] Seq=0 Win=29200 Len=0 MSS=1460 SACK_PERM TSval=140272 TSecr=0 WS=128"
"432","303.643044","10.8.8.110","198.7.63.141","DNS","63","Standard query 0x40b5 A ocsp.digicert.com"
"433","303.643141","10.8.8.110","198.7.63.141","DNS","63","Standard query 0x90bb A ocsp.digicert.com"
"434","303.643483","10.8.8.110","198.7.63.141","DNS","63","Standard query 0x7215 AAAA ocsp.digicert.com"
"435","303.763531","93.184.220.29","10.8.8.110","TCP","60","80  >  39921 [SYN, ACK] Seq=0 Ack=1 Win=14480 Len=0 MSS=1320 SACK_PERM TSval=4100209316 TSecr=140272 WS=512"
"436","303.763598","10.8.8.110","93.184.220.29","TCP","52","39921  >  80 [ACK] Seq=1 Ack=1 Win=29312 Len=0 TSval=140302 TSecr=4100209316"
"437","303.763631","198.7.63.141","10.8.8.110","DNS","235","Standard query response 0x40b5 A ocsp.digicert.com CNAME cs9.wac.phicdn.net A 93.184.220.29 NS ns1.phicdn.net NS ns2.phicdn.net A 72.21.80.5 AAAA 2606:2800:1::5 A 72.21.80.6 AAAA 2606:2800:1::6"
"438","303.763890","198.7.63.141","10.8.8.110","DNS","235","Standard query response 0x90bb A ocsp.digicert.com CNAME cs9.wac.phicdn.net A 93.184.220.29 NS ns1.phicdn.net NS ns2.phicdn.net A 72.21.80.5 AAAA 2606:2800:1::5 A 72.21.80.6 AAAA 2606:2800:1::6"
"439","303.763917","10.8.8.110","93.184.220.29","OCSP","489","Request"
"440","303.767438","198.7.63.141","10.8.8.110","DNS","160","Standard query response 0x7215 AAAA ocsp.digicert.com CNAME cs9.wac.phicdn.net SOA ns1.edgecastcdn.net"
"441","303.885414","93.184.220.29","10.8.8.110","TCP","52","80  >  39921 [ACK] Seq=1 Ack=438 Win=15872 Len=0 TSval=4100209347 TSecr=140302"
"442","303.896952","63.245.216.132","10.8.8.110","TCP","1252","443  >  39036 [PSH, ACK] Seq=1 Ack=186 Win=35312 Len=1212 [TCP segment of a reassembled PDU]"
"443","303.897007","10.8.8.110","63.245.216.132","TCP","40","39036  >  443 [ACK] Seq=186 Ack=1213 Win=32128 Len=0"
"444","303.897048","63.245.216.132","10.8.8.110","TCP","1252","443  >  39036 [PSH, ACK] Seq=1213 Ack=186 Win=35312 Len=1212 [TCP segment of a reassembled PDU]"
"445","303.897067","10.8.8.110","63.245.216.132","TCP","40","39036  >  443 [ACK] Seq=186 Ack=2425 Win=35072 Len=0"
"446","303.897088","63.245.216.132","10.8.8.110","TCP","1252","443  >  39036 [PSH, ACK] Seq=2425 Ack=186 Win=35312 Len=1212 [TCP segment of a reassembled PDU]"
"447","303.897102","10.8.8.110","63.245.216.132","TCP","40","39036  >  443 [ACK] Seq=186 Ack=3637 Win=38016 Len=0"
"448","303.897128","63.245.216.132","10.8.8.110","TLSv1.2","140","Server Hello, Certificate, Server Hello Done"
"449","303.897141","10.8.8.110","63.245.216.132","TCP","40","39036  >  443 [ACK] Seq=186 Ack=3737 Win=38016 Len=0"
"450","303.898004","10.8.8.110","63.245.216.132","TLSv1.2","382","Client Key Exchange, Change Cipher Spec, Encrypted Handshake Message"
"451","303.901099","10.8.8.110","93.184.220.29","TCP","60","39922  >  80 [SYN] Seq=0 Win=29200 Len=0 MSS=1460 SACK_PERM TSval=140337 TSecr=0 WS=128"
"452","303.904619","63.245.216.132","10.8.8.110","TCP","40","443  >  39035 [ACK] Seq=3737 Ack=528 Win=34976 Len=0"
"453","303.908905","63.245.216.132","10.8.8.110","TLSv1.2","115","Change Cipher Spec, Encrypted Handshake Message"
"454","303.918145","93.184.220.29","10.8.8.110","OCSP","840","Response"
"455","303.918145","10.8.8.110","93.184.220.29","TCP","52","39921  >  80 [ACK] Seq=438 Ack=789 Win=30848 Len=0 TSval=140341 TSecr=4100209355"
"456","303.919107","10.8.8.110","93.184.220.29","OCSP","489","Request"
"457","303.921088","10.8.8.110","63.245.216.132","TLSv1.2","589","Application Data"
"458","304.029916","93.184.220.29","10.8.8.110","TCP","60","80  >  39922 [SYN, ACK] Seq=0 Ack=1 Win=14480 Len=0 MSS=1320 SACK_PERM TSval=1097778712 TSecr=140337 WS=512"
"459","304.029960","10.8.8.110","93.184.220.29","TCP","52","39922  >  80 [ACK] Seq=1 Ack=1 Win=29312 Len=0 TSval=140369 TSecr=1097778712"
"460","304.042046","93.184.220.29","10.8.8.110","OCSP","840","Response"
"461","304.080112","10.8.8.110","93.184.220.29","TCP","52","39921  >  80 [ACK] Seq=875 Ack=1577 Win=32384 Len=0 TSval=140382 TSecr=4100209386"
"462","304.164417","63.245.216.132","10.8.8.110","TCP","40","443  >  39036 [ACK] Seq=3737 Ack=528 Win=34976 Len=0"
"463","304.167869","63.245.216.132","10.8.8.110","TLSv1.2","115","Change Cipher Spec, Encrypted Handshake Message"
"464","304.184578","63.245.216.132","10.8.8.110","TCP","40","443  >  39035 [ACK] Seq=3812 Ack=1077 Win=34416 Len=0"
"465","304.184646","63.245.216.132","10.8.8.110","TLSv1.2","685","Application Data"
"466","304.184941","10.8.8.110","63.245.216.132","TLSv1.2","93","Encrypted Alert"
"467","304.184970","10.8.8.110","63.245.216.132","TCP","40","39035  >  443 [FIN, ACK] Seq=1130 Ack=4457 Win=40448 Len=0"
"468","304.197939","10.8.8.110","198.7.63.141","DNS","74","Standard query 0x45be A blocklist.addons.mozilla.org"
"469","304.198001","10.8.8.110","198.7.63.141","DNS","74","Standard query 0x9954 AAAA blocklist.addons.mozilla.org"
"470","304.205060","10.8.8.110","63.245.216.132","TCP","40","39036  >  443 [ACK] Seq=528 Ack=3812 Win=38016 Len=0"
"471","304.321771","198.7.63.141","10.8.8.110","DNS","307","Standard query response 0x45be A blocklist.addons.mozilla.org A 63.245.217.114 A 63.245.217.115 A 63.245.217.113 NS ns4-64.akam.net NS ns1-240.akam.net NS ns7-66.akam.net NS ns5-65.akam.net A 84.53.139.64 A 184.85.248.65 A 96.7.49.66 A 193.108.91.240 AAAA 2600:1401:2::f0"
"472","304.321936","198.7.63.141","10.8.8.110","DNS","123","Standard query response 0x9954 AAAA blocklist.addons.mozilla.org SOA ns.mozilla.org"
"473","304.322350","10.8.8.110","63.245.217.114","TCP","60","54950  >  443 [SYN] Seq=0 Win=29200 Len=0 MSS=1460 SACK_PERM TSval=140442 TSecr=0 WS=128"
"474","304.449072","63.245.216.132","10.8.8.110","TCP","40","443  >  39035 [ACK] Seq=4457 Ack=1130 Win=40944 Len=0"
"475","304.449150","63.245.216.132","10.8.8.110","TCP","40","443  >  39035 [FIN, ACK] Seq=4457 Ack=1131 Win=40944 Len=0"
"476","304.449196","10.8.8.110","63.245.216.132","TCP","40","39035  >  443 [ACK] Seq=1131 Ack=4458 Win=40448 Len=0"
"477","304.575320","10.8.8.110","63.245.217.114","TCP","60","54951  >  443 [SYN] Seq=0 Win=29200 Len=0 MSS=1460 SACK_PERM TSval=140505 TSecr=0 WS=128"
"478","304.575561","10.8.8.110","198.7.63.141","DNS","74","Standard query 0xf036 A blocklist.addons.mozilla.org"
"479","304.587614","63.245.217.114","10.8.8.110","TCP","60","443  >  54950 [SYN, ACK] Seq=0 Ack=1 Win=14480 Len=0 MSS=1320 SACK_PERM TSval=1921295697 TSecr=140442 WS=1024"
"480","304.587685","10.8.8.110","63.245.217.114","TCP","52","54950  >  443 [ACK] Seq=1 Ack=1 Win=29312 Len=0 TSval=140508 TSecr=1921295697"
"481","304.587920","10.8.8.110","63.245.217.114","TLSv1.2","247","Client Hello (SNI=blocklist.addons.mozilla.org)"
"482","304.698084","198.7.63.141","10.8.8.110","DNS","307","Standard query response 0xf036 A blocklist.addons.mozilla.org A 63.245.217.115 A 63.245.217.113 A 63.245.217.114 NS ns7-66.akam.net NS ns4-64.akam.net NS ns1-240.akam.net NS ns5-65.akam.net A 84.53.139.64 A 184.85.248.65 A 96.7.49.66 A 193.108.91.240 AAAA 2600:1401:2::f0"
"483","304.844431","63.245.217.114","10.8.8.110","TCP","60","443  >  54951 [SYN, ACK] Seq=0 Ack=1 Win=14480 Len=0 MSS=1320 SACK_PERM TSval=1921295953 TSecr=140505 WS=1024"
"484","304.844499","10.8.8.110","63.245.217.114","TCP","52","54951  >  443 [ACK] Seq=1 Ack=1 Win=29312 Len=0 TSval=140573 TSecr=1921295953"
"485","304.844815","10.8.8.110","63.245.217.114","TLSv1.2","247","Client Hello (SNI=blocklist.addons.mozilla.org)"
"486","304.853003","63.245.217.114","10.8.8.110","TCP","52","443  >  54950 [ACK] Seq=1 Ack=196 Win=16384 Len=0 TSval=1921295963 TSecr=140508"
"487","304.853056","63.245.217.114","10.8.8.110","TLSv1.2","1360","Server Hello"
"488","304.853071","10.8.8.110","63.245.217.114","TCP","52","54950  >  443 [ACK] Seq=196 Ack=1309 Win=32128 Len=0 TSval=140575 TSecr=1921295963"
"489","304.853237","63.245.217.114","10.8.8.110","TLSv1.2","1360","Certificate"
"490","304.853254","10.8.8.110","63.245.217.114","TCP","52","54950  >  443 [ACK] Seq=196 Ack=2617 Win=35072 Len=0 TSval=140575 TSecr=1921295963"
"491","304.853280","63.245.217.114","10.8.8.110","TLSv1.2","53","Server Hello Done"
"492","304.853293","10.8.8.110","63.245.217.114","TCP","52","54950  >  443 [ACK] Seq=196 Ack=2618 Win=35072 Len=0 TSval=140575 TSecr=1921295963"
"493","304.854909","10.8.8.110","63.245.217.114","TLSv1.2","394","Client Key Exchange, Change Cipher Spec, Encrypted Handshake Message"
"494","304.856280","10.8.8.110","93.184.220.29","OCSP","489","Request"
"495","304.981924","93.184.220.29","10.8.8.110","OCSP","840","Response"
"496","304.981973","10.8.8.110","93.184.220.29","TCP","52","39921  >  80 [ACK] Seq=1312 Ack=2365 Win=34048 Len=0 TSval=140607 TSecr=4100209620"
"497","305.113616","63.245.217.114","10.8.8.110","TCP","52","443  >  54951 [ACK] Seq=1 Ack=196 Win=16384 Len=0 TSval=1921296223 TSecr=140573"
"498","305.113680","63.245.217.114","10.8.8.110","TLSv1.2","1360","Server Hello"
"499","305.113700","10.8.8.110","63.245.217.114","TCP","52","54951  >  443 [ACK] Seq=196 Ack=1309 Win=32128 Len=0 TSval=140640 TSecr=1921296223"
